id,image,text,type,original_dataset_label,model_prediction,human_annotation,majority_voting
91270,../FHM/img/91270.png,meanwhile at the isis strip club,train,0,1,1,1
37819,../FHM/img/37819.png,big and beautiful,train,0,0,,0
45691,../FHM/img/45691.png,call me sir one more time and i ll show you a sir macho ma am tranny savage,train,1,1,,1
35091,../FHM/img/35091.png,with black power comes no responsibility,train,0,0,,0
91537,../FHM/img/91537.png,gay people sex is so care free we cant get pregnant aids,train,1,1,,1
62710,../FHM/img/62710.png,what s shibe s favorite thing to eat n ggers a nuggers,train,1,0,1,1
76214,../FHM/img/76214.png,whatever this is it s an auburn fan,train,1,0,1,1
3681,../FHM/img/03681.png,when you re muslim but you have oil,train,0,0,,0
79053,../FHM/img/79053.png,yeah just over that hill on the other side of my property line that s where you can go fuck yourself,train,0,1,1,1
15493,../FHM/img/15493.png,she asked me to make her feel special so i gave her a helmet and crayons,train,0,0,,0
49017,../FHM/img/49017.png,that moment you use your white privileges,train,0,1,1,1
45209,../FHM/img/45209.png,look muddafucka even i know that s fucking retarded,train,1,1,,1
52130,../FHM/img/52130.png,i m not saying that your mom is a slut but when you were born she slid you back in and out a few times,train,0,1,1,1
46510,../FHM/img/46510.png,not every man is going to waste your time some are tired of the games and want nothing but loyalty too,train,0,0,,0
16520,../FHM/img/16520.png,stop making fun of our peaceful religion or we ll kill you,train,1,1,,1
12675,../FHM/img/12675.png,always dtsy positive,train,0,0,,0
8395,../FHM/img/08395.png,my dad is the best at hide and seek he s been gone for years,train,1,0,0,0
75192,../FHM/img/75192.png,we were known as hebrew israelites until slavery,train,0,1,1,1
34806,../FHM/img/34806.png,bro you still care about ace discourse bro kinda cringe ngl,train,0,0,,0
28605,../FHM/img/28605.png,i want you to wake the fuck up americans the fucking jews have hijacked your country,train,1,1,,1
7465,../FHM/img/07465.png,until you give the white man back his god everything i post is going to offend you,train,0,1,1,1
53914,../FHM/img/53914.png,let me play with the muslims,train,0,0,,0
17392,../FHM/img/17392.png,we are all apart of god s plan christ will come to us,train,0,0,,0
42675,../FHM/img/42675.png,glad she put the paper up someone might recognise her,train,0,0,,0
49785,../FHM/img/49785.png,when you feel mentally unwell seek help,train,0,0,,0
80957,../FHM/img/80957.png,i agree hi bro,train,1,0,0,0
91536,../FHM/img/91536.png,this man took millions of lives,train,0,1,1,1
69807,../FHM/img/69807.png,what is the most offensive joke you have ever written if only africa had more mosquito nets less mosquitos would have to die needlessly of aids,train,1,1,,1
72945,../FHM/img/72945.png,open up for the enrichment,train,1,0,0,0
50894,../FHM/img/50894.png,flowers for martin luther king day,train,1,0,0,0
93610,../FHM/img/93610.png,i should not be expected to pledge allegiance to any country including america dem representative ilhan omar quote,train,0,1,1,1
9251,../FHM/img/09251.png,you have adhd well i know a place i can send you where you ll learn to concentrate,train,1,0,1,1
90753,../FHM/img/90753.png,how many likes for this hero,train,0,0,,0
39645,../FHM/img/39645.png,remember when a lost alien just wanted to just go home what was that movie called,train,0,0,,0
24980,../FHM/img/24980.png,this is why we shoot you people,train,0,1,1,1
31709,../FHM/img/31709.png,patience good things come to those who wait,train,0,0,,0
93286,../FHM/img/93286.png,when your mom has to take a picture everywhere,train,0,0,,0
64781,../FHM/img/64781.png,meanwhile at the isis strip club,train,0,1,1,1
23514,../FHM/img/23514.png,diversity is our greatest strength,train,0,0,,0
64320,../FHM/img/64320.png,i said glass of juice not gas the jews,train,0,1,1,1
10867,../FHM/img/10867.png,official muslim refugee checkpoint,train,0,0,,0
95803,../FHM/img/95803.png,that s the way allah allah i like it put n the ham in mohamed,train,1,1,,1
62791,../FHM/img/62791.png,that s black people for ya what did you expect,train,0,1,1,1
83215,../FHM/img/83215.png,i ve been here once they stole my stuff and claimed god gave it to them,train,1,0,0,0
97604,../FHM/img/97604.png,london police speak with suspect,train,0,0,,0
5716,../FHM/img/05716.png,give me a dog treat human,train,0,0,,0
81705,../FHM/img/81705.png,human testosterone injections why would you think that,train,0,0,,0
4187,../FHM/img/04187.png,this is how muslims celebrate new year,train,0,0,,0
52619,../FHM/img/52619.png,the whiteman is the devil,train,0,1,0,0
38720,../FHM/img/38720.png,that one person in their feelings in the comments,train,0,0,,0
15029,../FHM/img/15029.png,they probably arguing over some little shit,train,1,0,0,0
8624,../FHM/img/08624.png,i saw a little jewish boy playing with an ash tray while walking down the road today i asked him if he was looking for his grandparents did jew nazi that this israeli funny,train,1,0,0,0
41925,../FHM/img/41925.png,when your in alabama and your year old sister says she wants a boyfriend,train,1,0,0,0
80932,../FHM/img/80932.png,a picture to remember our fun night out,train,0,0,,0
45930,../FHM/img/45930.png,if you got your phone wet try leaving it in dry rice overnight it will attract asians who will fix your electronics for you,train,0,1,0,0
19647,../FHM/img/19647.png,i grew up in a household where talking back got your ass whooped,train,0,1,1,1
36842,../FHM/img/36842.png,so you re against immigration splendid when do you leave,train,0,1,1,1
31629,../FHM/img/31629.png,me hey maybe we should accept people regardless of their sexual preferences islamic countries muslim noises,train,1,0,1,1
19426,../FHM/img/19426.png,omg the middle east has ninjas too,train,0,0,,0
40953,../FHM/img/40953.png,once you are in my pack i will always have your back,train,0,0,,0
7469,../FHM/img/07469.png,where is the criminal,train,0,0,,0
38209,../FHM/img/38209.png,when instincts take over,train,1,0,0,0
87235,../FHM/img/87235.png,stupid neighbours woke me up,train,0,0,,0
42160,../FHM/img/42160.png,riots in the streets,train,0,0,,0
49670,../FHM/img/49670.png,covers his wife from head to toes because sexual thoughts are satanic blows himself up because someone promised him virgins to f ck with,train,1,0,1,1
45126,../FHM/img/45126.png,when you don t know who to call the police or the rspca,train,1,0,0,0
86329,../FHM/img/86329.png,muslim people were killed at christchurch mosques muslim people were killed at christchurch,train,1,0,0,0
48930,../FHM/img/48930.png,this is not going to be the country of white people ilhan omar,train,1,1,,1
12039,../FHM/img/12039.png,never forget,train,0,0,,0
14632,../FHM/img/14632.png,after million years of evolution we have only lost the hair,train,1,0,0,0
64350,../FHM/img/64350.png,muslims and jews to the fuck off department muslims and jews to the fuck off department,train,1,1,,1
62084,../FHM/img/62084.png,the best way to get on your feet is to get off your ass,train,0,1,1,1
28049,../FHM/img/28049.png,mandatory work without exemptions i do nazi see the problem,train,0,1,1,1
56290,../FHM/img/56290.png,why doesn t aldi s have their own brand of nuts called aldi s nuts,train,0,0,,0
28935,../FHM/img/28935.png,this would be racist if black people could read,train,1,0,0,0
35417,../FHM/img/35417.png,must be time for more liberal bullshit,train,0,1,1,1
93082,../FHM/img/93082.png,who the fuck is that person,train,0,1,1,1
56249,../FHM/img/56249.png,who did this,train,1,0,0,0
23140,../FHM/img/23140.png,winter weather got your skin dry i ve got some lotion in the back,train,0,0,,0
68371,../FHM/img/68371.png,thankfully youtube blocked those videos or she might have popped even more people in their office,train,1,0,0,0
78039,../FHM/img/78039.png,homosexual,train,1,0,0,0
36014,../FHM/img/36014.png,official white house holiday ornaments,train,0,0,,0
86273,../FHM/img/86273.png,open carry when you re too much of a coward to enlist yet you want to intimidate people by playing army,train,0,1,1,1
23504,../FHM/img/23504.png,white trash an individual who may or may not be poor but is monumentally ignorant and stupid,train,1,1,,1
72608,../FHM/img/72608.png,dear lord thank you for making sure noah put turkey white tail deer elk and everything else we hunt on the ark amen,train,0,0,,0
10238,../FHM/img/10238.png,african girl suffering from a face deformity,train,0,1,0,0
35247,../FHM/img/35247.png,when your fifth wife comes home from the mosque showing a lot of ankle so you take her to the bedroom but her pussy smells like the neighbors goat,train,1,1,,1
46978,../FHM/img/46978.png,obama voters,train,0,0,,0
40857,../FHM/img/40857.png,you need to be on top of news,train,0,0,,0
93128,../FHM/img/93128.png,obama sucks liberals are dumb conservitives are great jesus is lord pro life get rid of illegals build a wall bomb isis obamacare is the devils work,train,1,1,,1
63784,../FHM/img/63784.png,these were the faulty wires that caused the fire at notre dame cathedral,train,1,0,0,0
81296,../FHM/img/81296.png,a tragedy,train,0,0,,0
37058,../FHM/img/37058.png,when blacks started wearing their pants low white people called it saggin spell saggin backwards those sneaky white people,train,1,1,,1
34028,../FHM/img/34028.png,two girls sitting in a cart east london,train,0,0,,0
98064,../FHM/img/98064.png,life hack your dishwasher can also wash your car,train,0,0,,0
76483,../FHM/img/76483.png,how police officers take out their trash,train,0,0,,0
92354,../FHM/img/92354.png,this is my step ladder i never knew my real ladder,train,0,0,,0
71830,../FHM/img/71830.png,what s the difference between the the first one can t sing when you put chains on it,train,0,0,,0
6541,../FHM/img/06541.png,hey i just met you and this is crazy but here s my number i ll gas your baby,train,1,1,,1
21569,../FHM/img/21569.png,esther you so ugly i m gonna take yo face and stamp out sum gorilla cookies,train,1,1,,1
4863,../FHM/img/04863.png,a little hood a little hippie,train,0,0,,0
87429,../FHM/img/87429.png,how do chinese people name their babies they throw them down the stairs and see what noise they make,train,1,1,,1
94350,../FHM/img/94350.png,i wonder is he s thinking about me siri find me interracial tranny amputee midget fisting porn,train,1,1,,1
24189,../FHM/img/24189.png,when you know how to say n r in five different languages i m kinda a gamer,train,1,0,0,0
26073,../FHM/img/26073.png,wanted fled from the kitchen,train,1,0,0,0
61908,../FHM/img/61908.png,under section of the australian constitution any person having allegiance to a foreign power is not entitled to a seat in our government the un is foreign power,train,0,1,1,1
46310,../FHM/img/46310.png,when your days are numbered but you can t count,train,1,0,0,0
89302,../FHM/img/89302.png,damn son where d you find this its ok baby im vice lord you do know know im a tranny right,train,1,1,,1
85901,../FHM/img/85901.png,woman painted herself for art project,train,0,0,,0
26179,../FHM/img/26179.png,woman takes adorable pregnancy announcment photos in a pasture with her horses,train,0,0,,0
59072,../FHM/img/59072.png,this er left the nfl to fight for his country please like and share to support glen coffee,train,0,0,,0
41387,../FHM/img/41387.png,the only time you ll see a muslim hugging a pig,train,0,1,1,1
8415,../FHM/img/08415.png,all people should be protected by those in blue,train,0,0,,0
38547,../FHM/img/38547.png,i only wear silk panties cotton ones remind me of slavery,train,1,1,,1
82674,../FHM/img/82674.png,democrats the test results are back and donald trump is your daddy,train,0,1,1,1
12608,../FHM/img/12608.png,polished aluminum f proof that you really can polish a turd,train,0,0,,0
2413,../FHM/img/02413.png,women ask for equal rights and this is why,train,0,1,1,1
51627,../FHM/img/51627.png,that s one way to get suspended from school,train,0,1,1,1
26318,../FHM/img/26318.png,when it is namaz time but you see a goat in the middle of the way,train,1,0,0,0
79584,../FHM/img/79584.png,who s down for a way,train,1,0,0,0
9547,../FHM/img/09547.png,if being a racist means i don t want my country turned into a pile of rocks and goatshit ruled by a barbaric cult then i m a racist,train,0,1,1,1
69470,../FHM/img/69470.png,how black people fight here how black people fight there,train,0,0,,0
8546,../FHM/img/08546.png,i m not saying you are a slut but you are easier than poland,train,1,1,,1
52803,../FHM/img/52803.png,me puts bag of popcorn into the microwave everyone at the senior center,train,1,0,0,0
63251,../FHM/img/63251.png,when you re fuhrking her from the back and she says i ll pay the gas bill daddy,train,1,1,,1
14823,../FHM/img/14823.png,you are the funny one maybe i ll kill you last,train,1,1,,1
14520,../FHM/img/14520.png,in space reverse cowgirl and doggy style are the same position,train,0,0,,0
57602,../FHM/img/57602.png,a talking ape,train,0,0,,0
46813,../FHM/img/46813.png,when you catch your teenage goat having sex for the first time,train,0,0,,0
70368,../FHM/img/70368.png,i want my virgins to be goats boys and bi curious donkey,train,1,1,,1
40791,../FHM/img/40791.png,white people is this a shooting range,train,0,0,,0
65908,../FHM/img/65908.png,never had one before what a room to yourself a white bitch,train,0,1,1,1
15738,../FHM/img/15738.png,you re black sorry no cure,train,1,1,,1
63417,../FHM/img/63417.png,joe you were a mistake curious george obama you ll be a bigger one creepy joe,train,0,1,1,1
51237,../FHM/img/51237.png,we about to get spicy and lit up in here,train,0,0,,0
30286,../FHM/img/30286.png,had to get wisdom teeth removed i guess you shouldn t have been such a smart mouth,train,0,0,,0
7254,../FHM/img/07254.png,muslims believe that if they get killed by a woman they go straight to hell well ladies it s time to lock and load,train,1,1,,1
12837,../FHM/img/12837.png,imagine if you will a group of people so disgusting they have to make laws making it illegal to hate them,train,1,0,1,1
95814,../FHM/img/95814.png,yo mama s so dumb she lost a rigged election,train,0,1,1,1
52716,../FHM/img/52716.png,best holiday gift for animal lovers,train,0,0,,0
65940,../FHM/img/65940.png,all animals are our friends,train,0,0,,0
39175,../FHM/img/39175.png,when your dad passes the family school shooting gun down to you,train,0,0,,0
68903,../FHM/img/68903.png,he might only be here for part of your life but for him you are his whole life,train,0,0,,0
4287,../FHM/img/04287.png,that s it back to the kitchen where s my sammich women s day is over,train,1,0,1,1
26319,../FHM/img/26319.png,life handed me lemons so i fucked them and gave them lemon aids,train,1,1,,1
24653,../FHM/img/24653.png,baboons on their way home,train,0,0,,0
13248,../FHM/img/13248.png,i don t have time to be racist when i have my american muscle with four working tires,train,0,0,,0
41958,../FHM/img/41958.png,when you re trying to take family portraits but white trash is life that little girl on the right could teach you everything you need to know about life,train,1,0,1,1
17054,../FHM/img/17054.png,lesbians when they spot a hot straight girl call me tina cos i m gonna turner,train,1,0,0,0
52960,../FHM/img/52960.png,every time a person is offended on social media a vote is cast for trump,train,0,0,,0
81245,../FHM/img/81245.png,when you are hanging out with your black friends and they finally give you a cool nickname cracker,train,1,1,,1
90127,../FHM/img/90127.png,ford promotion free aaa membership,train,0,0,,0
3871,../FHM/img/03871.png,justin trudeau the imam of canada,train,1,0,0,0
71625,../FHM/img/71625.png,my new wife is like my car years old and stolen from europe,train,1,0,0,0
84907,../FHM/img/84907.png,i keep asking what lgbtq stands for so many letters to remember,train,0,0,,0
9376,../FHM/img/09376.png,i might not be good at sucking cock but i can put beavers outta work,train,0,1,1,1
92408,../FHM/img/92408.png,go into china town you don t see negro stores go into jew town you don t see negro stores but come up here in black town and every kind of store is here but yours malcolm x,train,1,0,1,1
41325,../FHM/img/41325.png,i suppose a sandwich is out of the question,train,0,0,,0
57826,../FHM/img/57826.png,if this is what they call pride then i don t wanna see what they call shame,train,1,0,1,1
52318,../FHM/img/52318.png,when your kid actually is transgender,train,0,0,,0
63025,../FHM/img/63025.png,when the serb kid starts talking mad shit,train,1,0,1,1
35902,../FHM/img/35902.png,when all those shrugs from not knowing what to eat are starting to pay off,train,0,0,,0
90573,../FHM/img/90573.png,what kind of punch can take out kids and adults a sandy hook,train,0,1,0,0
73154,../FHM/img/73154.png,when you want to enter islam when you want to leave islam,train,1,0,0,0
19234,../FHM/img/19234.png,is this motherfucker serious where the fuck am i supposed to find a truckload of bitches,train,0,1,1,1
83764,../FHM/img/83764.png,muslim at the entrance hello brother brenton tarrant,train,1,1,,1
30697,../FHM/img/30697.png,the plate is so hot al gore is using it as evidence of global warming,train,0,0,,0
48162,../FHM/img/48162.png,is someone using the oven cuz i smell gas,train,1,0,0,0
18942,../FHM/img/18942.png,who s a birthday girl you re a birthday girl,train,0,0,,0
23450,../FHM/img/23450.png,i m beautiful,train,0,0,,0
1327,../FHM/img/01327.png,i m not sick i m twisted sick makes it sound like there s a cure,train,0,0,,0
70194,../FHM/img/70194.png,ancient problems require jewish solutions needs to steal a bracelet becomes shlomo ben yisrael,train,1,0,0,0
65380,../FHM/img/65380.png,is your name winter because you ll be coming soon,train,0,0,,0
34652,../FHM/img/34652.png,if you re gonna go boating make sure you have the proper flotation devices,train,1,0,0,0
15439,../FHM/img/15439.png,goat yoga is my favorite sport,train,0,0,,0
83921,../FHM/img/83921.png,this faceapp stuff is incredible,train,1,0,0,0
46857,../FHM/img/46857.png,when people get added when people real ize what kind of group this really is,train,0,0,,0
69140,../FHM/img/69140.png,remember when illegal aliens just wanted to just go home now they want free food healthcare and housing,train,1,1,,1
35016,../FHM/img/35016.png,yo dude who passed the aux cord,train,0,0,,0
87351,../FHM/img/87351.png,when you realize you left the stove on at home,train,0,0,,0
39452,../FHM/img/39452.png,then he said i couldn t come to the barbecue because i always burn the franks,train,0,0,,0
75320,../FHM/img/75320.png,japan soars to its highest temperature ever recorded degrees that s where you re wrong kiddo,train,0,0,,0
46983,../FHM/img/46983.png,when your dishwasher is broken so you take it back to walmart to get a new one,train,0,0,,0
1875,../FHM/img/01875.png,does anyone know if he had a donor card i need parts for my go cart,train,0,0,,0
79854,../FHM/img/79854.png,you knew that was the wrong hole you re goddamn right i did,train,1,0,1,1
35271,../FHM/img/35271.png,you knew i was a snake when you let me in,train,0,1,1,1
79321,../FHM/img/79321.png,captain america when he arrives back in the forties i m gonna say the n word,train,1,1,,1
31426,../FHM/img/31426.png,michelle obama without makeup,train,1,0,0,0
26379,../FHM/img/26379.png,straight outta oven,train,0,0,,0
81902,../FHM/img/81902.png,i m not a smart man but at least i didn t vote for trump,train,0,0,,0
81602,../FHM/img/81602.png,this transgendershit is getting outta hand,train,1,1,,1
78631,../FHM/img/78631.png,is there anything more beautiful than the islamic call to prayer,train,0,0,,0
90365,../FHM/img/90365.png,a muslim in congress wants to get rid of homeland security let that sink in years after and this is where we are at,train,0,1,1,1
63187,../FHM/img/63187.png,gaming in north korea if you die in game you die in real life,train,1,0,1,1
15893,../FHM/img/15893.png,how many mexicans does it take to build a oh wow they re done,train,1,0,0,0
60741,../FHM/img/60741.png,most of our clothes come from this,train,0,0,,0
78401,../FHM/img/78401.png,friends house and he when you at your white starts stabbing his parents only the dead can know peace from this evil,train,1,1,,1
84152,../FHM/img/84152.png,when your dishwasher is done for good,train,1,0,0,0
46952,../FHM/img/46952.png,what you americans guna do when they build a wall to keep yall out,train,0,0,,0
69237,../FHM/img/69237.png,temptation,train,0,0,,0
59260,../FHM/img/59260.png,my priceless child porn collection you stupid goyim owe me million sheckles,train,1,1,,1
51978,../FHM/img/51978.png,jesus doesn t care how many bible verses you have memorized he cares about how you treat people,train,0,0,,0
19027,../FHM/img/19027.png,i hate things racism sexism and white men,train,0,1,1,1
71645,../FHM/img/71645.png,i don t need to use my hands to kick your ass,train,0,1,1,1
6194,../FHM/img/06194.png,burning things that don t mean anything to you,train,1,0,0,0
50723,../FHM/img/50723.png,i will lie i will sleep with anyone i will attack sexual perverts like joe biden in my own party to get ahead i will let illegals murder americans i will let newborns be i want to be your comfortable and executed president,train,1,1,,1
7839,../FHM/img/07839.png,dont fuck with me my husband is married to vladimir putin,train,0,1,1,1
52316,../FHM/img/52316.png,the face i make when the media calls bruce jenner catlyn jenner,train,1,0,0,0
97842,../FHM/img/97842.png,there s so much white trash in this picture i barely know where to start,train,1,1,,1
28976,../FHM/img/28976.png,when you re hiding from a shooter in your school and the foreign exchange student keeps on crying american students first time,train,0,0,,0
46198,../FHM/img/46198.png,american class american trash,train,0,0,,0
14837,../FHM/img/14837.png,can you please tag laura and let her know she has left her bra,train,0,0,,0
71206,../FHM/img/71206.png,my brother the more girlfriends you have the more money you lose the more you don t progress in life find one girlfriend invest in her and build your future together,train,0,0,,0
30824,../FHM/img/30824.png,where did you learn to do it so good me when i was,train,0,0,,0
7931,../FHM/img/07931.png,how black people became christians,train,1,0,1,1
2983,../FHM/img/02983.png,large big mac no onions,train,0,0,,0
15674,../FHM/img/15674.png,then he said i couldn t come to the barbecue because i always burn the hamburgers,train,0,0,,0
64193,../FHM/img/64193.png,you just ran past full retard and went straight to potato,train,1,1,,1
65378,../FHM/img/65378.png,drink bleach then you can be white on the inside and out,train,0,1,1,1
28765,../FHM/img/28765.png,and just like that people forgot about area started wanting to look like year olds,train,0,0,,0
30462,../FHM/img/30462.png,if you have a beard but can t change a tire shave,train,0,0,,0
46301,../FHM/img/46301.png,if black people aren t lazy then why doesn t kfc have a breakfast menu,train,1,0,1,1
32806,../FHM/img/32806.png,when you start to choke but your uncle knows the heimlich maneuver,train,0,0,,0
59362,../FHM/img/59362.png,obama s fbi did not break rules or policies they broke laws they did not make mistakes they committed crimes,train,0,0,,0
34915,../FHM/img/34915.png,just trying to do my part,train,1,0,0,0
97102,../FHM/img/97102.png,a monkey wearing makeup and a dress does not make it a woman and a man wearing makeup and a dress is also not a woman,train,1,0,0,0
71486,../FHM/img/71486.png,if you re constantly referring to your skin color or other people s skin color maybe you re the racist,train,0,1,1,1
56281,../FHM/img/56281.png,liberals before the election trump and his supporters must accept the results of the election liberals after the election i do not accept the results of the election,train,0,1,1,1
69024,../FHM/img/69024.png,is my smile creeping you out you need to tell me if my smile is creeping you out,train,0,0,,0
86910,../FHM/img/86910.png,this is what happens when white people lose white privilege,train,1,0,1,1
97413,../FHM/img/97413.png,your birthday it is old you have become,train,0,0,,0
97564,../FHM/img/97564.png,sign says take a quarter takes two,train,0,0,,0
79806,../FHM/img/79806.png,when you ask them if they re having a seizure but they just spasm on the ground instead of answering you all right then keep your secrets,train,0,0,,0
12309,../FHM/img/12309.png,i don t know how to deal with criminals i guess i ll take a shot at them,train,0,0,,0
17598,../FHM/img/17598.png,when you have an point iq but it s the highest in your village,train,0,0,,0
61032,../FHM/img/61032.png,if being racist means that i don t want people of color in my country then i am not a racist,train,0,1,1,1
62384,../FHM/img/62384.png,whenever your owner walks to fast,train,0,0,,0
52743,../FHM/img/52743.png,like a hot ls swapped rx girl with a penis,train,1,0,1,1
52904,../FHM/img/52904.png,when you eat her ass and then she say that she don t suck dick wayment,train,1,1,,1
6325,../FHM/img/06325.png,trump donated his salary to alcoholism research i see it as a personal attack,train,0,1,1,1
17483,../FHM/img/17483.png,when someone asks why im such a cunt just am,train,0,1,1,1
21943,../FHM/img/21943.png,is it a boy or a girl,train,0,0,,0
28195,../FHM/img/28195.png,gotta be careful who you fuck with people will learn you just to hurt you,train,0,1,1,1
46315,../FHM/img/46315.png,question how do blind people know when to stop wiping their asses,train,1,0,0,0
10256,../FHM/img/10256.png,and if anything happens the women are to blame that s right it s their fault definitely,train,1,1,,1
19650,../FHM/img/19650.png,when it s the s and you just got here from africa master looks after us now,train,0,0,,0
7523,../FHM/img/07523.png,man caught having sex with a feminist at the beach,train,1,0,0,0
24905,../FHM/img/24905.png,nascar presents the wal mart,train,0,0,,0
69017,../FHM/img/69017.png,all was well in new york until the fire nation attacked,train,0,0,,0
9413,../FHM/img/09413.png,when you start fingering yourself but your sister cums instead,train,1,1,,1
