id,image,text,type,original_dataset_label,model_prediction,human_annotation,majority_voting
42953,../FHM/img/42953.png,its their character not their color that matters,train,0,0,,0
23058,../FHM/img/23058.png,don t be afraid to love again everyone is not like your ex,train,0,0,,0
13894,../FHM/img/13894.png,putting bows on your pet,train,0,0,,0
37408,../FHM/img/37408.png,i love everything and everybody except for squirrels i hate squirrels,train,0,0,,0
82403,../FHM/img/82403.png,everybody loves chocolate chip cookies even hitler,train,0,0,,0
16952,../FHM/img/16952.png,go sports do the thing win the points,train,0,0,,0
76932,../FHM/img/76932.png,fine you re right now can we fucking drop it,train,0,1,1,1
70914,../FHM/img/70914.png,tattoos are bad for your health i know million people that had tattoos and they all died,train,0,1,1,1
2973,../FHM/img/02973.png,how long can i run till the chain tightens,train,0,0,,0
58306,../FHM/img/58306.png,what is he hiding we need to see his tax returns let me stop you right there hillary you deleted emails used bleach bit on hard drives then destroyed phones with hammers you have no right to talk about people hiding anything truth uncensored,train,0,1,1,1
79351,../FHM/img/79351.png,jew mad get fuhrerious,train,1,1,,1
34096,../FHM/img/34096.png,removes polish with chemicals nobody bats an eye,train,0,0,,0
25489,../FHM/img/25489.png,brother a day without a blast is a day wasted,train,1,0,1,1
19324,../FHM/img/19324.png,when you re the only dog left at the dog shelter and the black family wants to adopt you,train,0,0,,0
79346,../FHM/img/79346.png,voting for hillary is like letting casey anthony watch your kids because she s not guilty,train,0,1,1,1
13426,../FHM/img/13426.png,they will soon be free,train,0,0,,0
97628,../FHM/img/97628.png,is it ok for your son or daughter to call another man daddy,train,0,0,,0
14238,../FHM/img/14238.png,most religions are religions of peace,train,0,0,,0
28936,../FHM/img/28936.png,when you find out there s an opening for the role of first lady,train,0,0,,0
59784,../FHM/img/59784.png,if people reject me because i stand on the truth then i have no problem walking alone,train,0,0,,0
2146,../FHM/img/02146.png,from the bottom of my heart i would like to sincerely apologize for being white,train,0,1,1,1
70146,../FHM/img/70146.png,lets erect a memorial to all the americans murdered by an illegal alien make it miles long feet tall and put it on the southern border,train,0,1,1,1
28061,../FHM/img/28061.png,just because they do this dosen t mean they ll do this,train,0,0,,0
97180,../FHM/img/97180.png,if there is no race it can t be homicide,train,0,0,,0
49752,../FHM/img/49752.png,here s to all my friends who never post about politics or religion,train,0,0,,0
25610,../FHM/img/25610.png,enjoying a day at the beach,train,0,0,,0
15872,../FHM/img/15872.png,when you come home from a long day of suicide bombinb and your wife gives you this look,train,0,0,,0
72640,../FHM/img/72640.png,is bribing muslims for liberal votes justin trudeau s only skill why does justin trudeau love foreigners so much while openly disrespecting canadians canadian values our history and traditions our seniors and veterans sharia law has no place in canada never has never will,train,1,1,,1
64318,../FHM/img/64318.png,when they take too long to blow out the candle,train,0,0,,0
17956,../FHM/img/17956.png,one simple question why are we letting one man systematically destroy our nation before our eyes answer mitch mcconnell,train,0,1,1,1
93547,../FHM/img/93547.png,d j osama spin laden droppin beats like the twin towers,train,1,0,0,0
10743,../FHM/img/10743.png,move to new york they said it ll be fun they said,train,0,0,,0
37091,../FHM/img/37091.png,my sandwich maker is very slow today,train,0,0,,0
25719,../FHM/img/25719.png,when you accidentally fall in the toilet,train,0,0,,0
76825,../FHM/img/76825.png,two woman walking home together after a nice day out together,train,0,0,,0
72598,../FHM/img/72598.png,texas churches be like pew pew pew,train,0,0,,0
43078,../FHM/img/43078.png,i don t always have a heat stroke and get frostbite in the same week but when i do i know i m in kentucky,train,0,0,,0
51846,../FHM/img/51846.png,doesn t wear tampons because she trips over the string,train,0,0,,0
1569,../FHM/img/01569.png,when you can t decide to pre heat the oven or just throw the meal in right away,train,0,0,,0
95812,../FHM/img/95812.png,happy shot in the face day,train,0,1,1,1
6418,../FHM/img/06418.png,bomb every minute,train,0,0,,0
53976,../FHM/img/53976.png,black power comes with a lot of responsibility,train,0,0,,0
70193,../FHM/img/70193.png,that chiken is so black no one is going to eat it,train,0,1,1,1
60427,../FHM/img/60427.png,i hope both teams lose,train,0,0,,0
78395,../FHM/img/78395.png,say the damn pronouns,train,0,0,,0
4876,../FHM/img/04876.png,goin,train,0,0,,0
92075,../FHM/img/92075.png,we need problem solvers not racist and religious bigots in office,train,0,1,1,1
86354,../FHM/img/86354.png,officer down,train,0,0,,0
74386,../FHM/img/74386.png,we said we would never forget why are you voting them into our government,train,1,0,1,1
59613,../FHM/img/59613.png,when a porn video features a tranny but then she turns out to be a midget too you had my curiosity but now you have my attention,train,0,1,1,1
10263,../FHM/img/10263.png,rep dan crenshaw former navy seal decorated war hero literally lost an eye doing something about terrorism rep ocasio cortez former bartender supports socialism told dan crenshawn he should do something about terrorism,train,0,1,1,1
48279,../FHM/img/48279.png,nice watch must have cost an arm and a leg,train,0,0,,0
52610,../FHM/img/52610.png,i m sick of politics so here s a pic of michelle obama riding a unicorn,train,1,0,0,0
58371,../FHM/img/58371.png,when you suck at photoshop,train,0,0,,0
27401,../FHM/img/27401.png,for the last time i m not michelle obama,train,0,0,,0
89574,../FHM/img/89574.png,i m cute,train,0,0,,0
25473,../FHM/img/25473.png,and then i told them you re going on a fun camping trip,train,0,0,,0
47913,../FHM/img/47913.png,the jussie smollett case explained how do you plead innocent black gay trump hater friend of michelle obama,train,0,1,1,1
8295,../FHM/img/08295.png,please consider donating water to children in need,train,0,0,,0
2497,../FHM/img/02497.png,you re a wizard motherfucker,train,0,1,1,1
90471,../FHM/img/90471.png,relax mexicans you are rapists drug lords and criminals,train,0,1,1,1
69357,../FHM/img/69357.png,hey look at me i m a serial pedofile,train,1,1,,1
54602,../FHM/img/54602.png,when you just finished shooting a bunch of black kids but accidently killed a squirrel,train,1,1,,1
15320,../FHM/img/15320.png,obama working to legalize medical cannabis for all of the usa,train,0,0,,0
63182,../FHM/img/63182.png,my wife just got a seashell tattoo on her inner thigh if you put your ear to it you can smell the ocean,train,0,0,,0
20619,../FHM/img/20619.png,when you beat the shit out of the tranny hooker after you nut and call it a f t but it doesn t get back up,train,1,1,,1
82457,../FHM/img/82457.png,ring ring hello i ve been waiting for your call all damn day,train,0,1,1,1
81059,../FHM/img/81059.png,i like my refugees like this,train,0,1,0,0
42137,../FHM/img/42137.png,when you get hungry you can either think about it or,train,0,0,,0
74530,../FHM/img/74530.png,what s the difference between a jew and a pizza a pizza doesn t scream when you put it in the oven,train,1,0,0,0
40832,../FHM/img/40832.png,taking photo with a mosque,train,0,0,,0
46127,../FHM/img/46127.png,ay tone how d da gas stay in if da door is made of wood,train,0,0,,0
87594,../FHM/img/87594.png,what do i have in common with cow pies the older we get the easier for you to pick us up,train,0,0,,0
12548,../FHM/img/12548.png,running chocolate,train,0,0,,0
12894,../FHM/img/12894.png,imagine if you will an entire country so ignorant that the people wilfully give billions of dollars in order to elect rich criminals to rule over their lives and steal their money but believe they are free,train,0,1,1,1
2476,../FHM/img/02476.png,im never doing a garden again,train,0,0,,0
6937,../FHM/img/06937.png,coming soon to your neighborhood islamic heathens demanding the usa change to suit thier sick religion,train,0,1,1,1
5762,../FHM/img/05762.png,listen bitch before you start fucking with me you should know my team is bigger,train,0,1,1,1
40259,../FHM/img/40259.png,masturbation it s not just for men,train,0,0,,0
85072,../FHM/img/85072.png,what is this sleep of which you speak,train,0,0,,0
46537,../FHM/img/46537.png,oakland mayor libby schaaf i saved ms rapists murderers molesters from ice,train,0,1,1,1
56432,../FHM/img/56432.png,what if i told you that you cant tolerate a person who agrees with you,train,0,1,1,1
39805,../FHM/img/39805.png,look both ways before you cross the street,train,0,0,,0
29163,../FHM/img/29163.png,what kind of punch can take out kids and adults a sandy hook,train,1,0,0,0
36072,../FHM/img/36072.png,she said choke me daddy so i gave her popeye s biscuits without a drink,train,0,0,,0
60147,../FHM/img/60147.png,meditation before going to school,train,0,0,,0
90583,../FHM/img/90583.png,we can kill as many as we want and your stupid government keeps bringing us in,train,1,1,,1
38612,../FHM/img/38612.png,so there is this new implant that can actually fix stupid,train,0,0,,0
52097,../FHM/img/52097.png,if you re vaping inside a mcdonalds inside a walmart that s the turducken of white trash,train,1,0,1,1
34961,../FHM/img/34961.png,this cat is pushing a watermelon out of a lake your argument is invalid,train,0,0,,0
15803,../FHM/img/15803.png,what do you call a retarded jew auschwistic,train,1,1,,1
89762,../FHM/img/89762.png,that blackened chicken was so dry it reminded me of your mother,train,0,1,1,1
38465,../FHM/img/38465.png,yo dawg i heard you like memes so i made a meme mocking memes you so you can can mock me knocking memes while reading mock memes,train,0,0,,0
53289,../FHM/img/53289.png,when everybody s worried about their ex but you re just here enjoying your lemonade,train,0,0,,0
75321,../FHM/img/75321.png,cannibal tribe from indonesia will take muslim refugess in any amount,train,1,1,,1
18350,../FHM/img/18350.png,when you see the gas bill,train,0,0,,0
91547,../FHM/img/91547.png,cheers to all the people who can change their minds when presented with information that contradicts their beliefs,train,0,0,,0
30247,../FHM/img/30247.png,broken chair,train,0,0,,0
93741,../FHM/img/93741.png,stop being a bitch,train,0,1,1,1
51243,../FHM/img/51243.png,honestly how often do you masturbate,train,0,0,,0
5384,../FHM/img/05384.png,spending quality time with dad,train,0,0,,0
1845,../FHM/img/01845.png,when you consume too much trans fat,train,0,0,,0
34791,../FHM/img/34791.png,when i was a boy we didn t have things like adhd it was called being a little bastard,train,1,0,1,1
41385,../FHM/img/41385.png,y all kids claims to be victims of slavery when we were the ones who lived it,train,0,1,1,1
34508,../FHM/img/34508.png,jews are the problem not just zionists or israelis jews all of them,train,1,1,,1
80521,../FHM/img/80521.png,him the dishwasher is acting weird her what s it doing him chopping fucking vegetables,train,0,1,1,1
34165,../FHM/img/34165.png,be happy you dont have neanderthal dna,train,0,0,,0
93072,../FHM/img/93072.png,black people black people why would white america do this,train,1,0,1,1
25468,../FHM/img/25468.png,white people walked on all fours before black people came and showed them how to stand up,train,1,1,,1
9617,../FHM/img/09617.png,when you turn on the light and realize you have been fisting the wrong hole,train,0,1,1,1
96258,../FHM/img/96258.png,its national hebrew day go pick up a hot girl,train,0,1,1,1
96578,../FHM/img/96578.png,mohammad is fucked by blink hacker group oink oink hi my name s mohammad fuck you muslims,train,1,1,,1
35618,../FHM/img/35618.png,i woke up like this,train,0,0,,0
5249,../FHM/img/05249.png,i am still so confused about the strategies in this game,train,0,0,,0
57349,../FHM/img/57349.png,at first i didn t want to wear a hijab but my husband convinced me otherwise,train,0,0,,0
78409,../FHM/img/78409.png,i stand with hitler these was this time at auschwitz when i needed medical attention and doctor mengele was there for me,train,1,1,,1
29814,../FHM/img/29814.png,if you hold a black baby to your ear you can hear the police sirens,train,1,0,0,0
20568,../FHM/img/20568.png,meanwhile at the isis strip club,train,0,1,1,1
84269,../FHM/img/84269.png,just ordered the new anne frank puzzle,train,0,0,,0
68079,../FHM/img/68079.png,what s the difference between a walrus and a lesbian one smells like fish and has a moustache and the other is a walrus,train,0,0,,0
41537,../FHM/img/41537.png,i m not transphobic i just think trans people shouldn t exist,train,0,1,1,1
12890,../FHM/img/12890.png,hitler getting his tan on,train,0,1,1,1
54102,../FHM/img/54102.png,i m uncertain where i stand on abortion i like the killing babies but hate the idea of giving women a choice,train,1,1,,1
63217,../FHM/img/63217.png,when you re facetimeing and accidently fall down the stairs,train,0,0,,0
3271,../FHM/img/03271.png,when your wife and girlfriend dont get along,train,0,1,1,1
35264,../FHM/img/35264.png,i like your cologne what is that tricare deers,train,0,0,,0
63710,../FHM/img/63710.png,literally nobody white people sitting at the bar can you put it on the golf channel,train,1,0,0,0
12348,../FHM/img/12348.png,bitch say something else,train,0,1,1,1
14052,../FHM/img/14052.png,this is racist but this is not,train,1,0,0,0
81064,../FHM/img/81064.png,your tits in my hands put them you will,train,0,1,1,1
74391,../FHM/img/74391.png,there must be some way this victimizes me,train,0,0,,0
36152,../FHM/img/36152.png,when your eating out your grandma and you taste horse cum then think to yourself oh that s how she died,train,0,1,1,1
80256,../FHM/img/80256.png,damn girl that s a policy i could get behind,train,0,0,,0
21948,../FHM/img/21948.png,this guy grabs your girl s ass in the bar what do you do,train,0,1,1,1
70532,../FHM/img/70532.png,it s important to listen to your elders please don t forget,train,0,0,,0
25806,../FHM/img/25806.png,when you have to make your own pool,train,0,0,,0
26759,../FHM/img/26759.png,that look when you wanna cut a bitch but you remember your a changed man,train,1,0,1,1
27398,../FHM/img/27398.png,if you believe that i ve got a virgin goat to sell you,train,0,0,,0
18730,../FHM/img/18730.png,immigration invasion learn the difference,train,0,0,,0
75216,../FHM/img/75216.png,want one as a slave when you watch how slow they work and you wonder why anyone would,train,0,1,1,1
91754,../FHM/img/91754.png,when you finally buy a dishwasher this works a lot better than a sponge,train,0,0,,0
42153,../FHM/img/42153.png,we build our houses with stone,train,0,0,,0
83456,../FHM/img/83456.png,whats the difference between santa and the jews santa goes down the chimney,train,1,1,,1
18673,../FHM/img/18673.png,how to remember kid in hot car keep nd road beer with them,train,0,0,,0
97523,../FHM/img/97523.png,you are so cute,train,0,0,,0
24631,../FHM/img/24631.png,it s ma am yooouu lookah like a man,train,1,0,1,1
23748,../FHM/img/23748.png,bigbird singing to child on seasame street,train,0,0,,0
69412,../FHM/img/69412.png,best part about a hooker dying on you the nd hour is free,train,0,1,1,1
59073,../FHM/img/59073.png,the enemy within ilhan omar linda sarsour rashida tlaib ocasto cortez,train,0,1,1,1
28405,../FHM/img/28405.png,white people already paid reparations,train,0,1,1,1
63492,../FHM/img/63492.png,making america white again,train,0,0,,0
92670,../FHM/img/92670.png,scared you today didn t i,train,0,0,,0
78351,../FHM/img/78351.png,subway is similar to prostitution you pay someone else to do your wife s job,train,0,0,,0
79856,../FHM/img/79856.png,my friends coming to see me after a crazy friday night,train,0,0,,0
71436,../FHM/img/71436.png,trump supporters be like mexicans stole my teeth,train,0,1,1,1
3258,../FHM/img/03258.png,i heard we can get free steroids in australia please help feed and house this poor defenceless refugee don t be racist and let me in,train,1,1,,1
20736,../FHM/img/20736.png,go be gay somewhere else,train,1,1,,1
50487,../FHM/img/50487.png,celebreated on january th because i know how to reduce fractions,train,0,0,,0
6431,../FHM/img/06431.png,when the employee asks what bra size you wear,train,0,0,,0
51473,../FHM/img/51473.png,god creates jews god creates jesus jews kill jesus god creates hitler god,train,1,1,,1
34901,../FHM/img/34901.png,gays aids it really be like that,train,0,0,,0
28793,../FHM/img/28793.png,congratulations it s non binary,train,0,0,,0
5172,../FHM/img/05172.png,islam is the religion of peace if you don t agree i kill you,train,0,1,1,1
98501,../FHM/img/98501.png,send me sexy pic,train,0,1,1,1
96231,../FHM/img/96231.png,when you re a convicted rapist but reruns of your show are still on tv because it s not like you tweeted something,train,0,1,1,1
81673,../FHM/img/81673.png,when they don t get the memo that they lost the war,train,0,1,1,1
48635,../FHM/img/48635.png,the look you give when the bubbles in the pool are pulsating your pussy just kidding she s retarted and thats her normal face,train,1,1,,1
43612,../FHM/img/43612.png,racing for pink slips in africa,train,1,0,0,0
15480,../FHM/img/15480.png,we kill you on and you elect of us to congress stupid infidels,train,1,1,,1
41830,../FHM/img/41830.png,if he s marrying me then why s he fucking my mom,train,0,1,1,1
81069,../FHM/img/81069.png,when you bout to nut in your cousin and you hear the barn door open,train,0,1,1,1
72584,../FHM/img/72584.png,months before i was born i went to a party with my dad and left with my mom,train,0,0,,0
51763,../FHM/img/51763.png,go be gay somewhere else,train,0,1,1,1
6873,../FHM/img/06873.png,just got a bootleg copy of muslim porn deep goat,train,1,1,,1
8523,../FHM/img/08523.png,cute getting ready to start kid her life too bad shes already fkn dead raped and murdered by an illegal immigrant,train,1,1,,1
6359,../FHM/img/06359.png,what women think they ll do when the economy collapses vs what they ll actually do,train,0,0,,0
93260,../FHM/img/93260.png,when she smiles at you from a distance,train,0,0,,0
40839,../FHM/img/40839.png,see if you can find the guys from white chicks lol,train,0,0,,0
8516,../FHM/img/08516.png,smirked at an adult media coverage days shot up a school media coverage days,train,0,0,,0
53012,../FHM/img/53012.png,nothing says pull me over like some red solo cup brake lights,train,0,0,,0
76250,../FHM/img/76250.png,chillin with my chromies,train,1,0,0,0
26198,../FHM/img/26198.png,hillary isn t in jail the wall isn t built isis hasn t been defeated obamacare is still in place but trump gave himself a million tax cut and that is important to me,train,0,1,1,1
61952,../FHM/img/61952.png,what i say about the gunman every time there s a mass shooting,train,0,0,,0
80269,../FHM/img/80269.png,this is really out of mein kampfert zone,train,1,0,1,1
5712,../FHM/img/05712.png,god will forgive you no matter what you ve done sweet,train,0,0,,0
72941,../FHM/img/72941.png,hey liberals democrats have you forgotten,train,0,1,1,1
21853,../FHM/img/21853.png,pure american muscle,train,0,0,,0
35219,../FHM/img/35219.png,they stole ma chickin i stole their life,train,1,0,1,1
90146,../FHM/img/90146.png,all races are equal,train,0,0,,0
51278,../FHM/img/51278.png,when you haven t stolen anything in a week,train,0,0,,0
63095,../FHM/img/63095.png,when you have errands to run but you re too tired to deal,train,0,0,,0
96058,../FHM/img/96058.png,husband gives massage aaaand now i have a dick in me,train,0,1,1,1
56871,../FHM/img/56871.png,who cares if mexicans are offended americans are offended by illegal immigration,train,1,1,,1
25180,../FHM/img/25180.png,hold up when she says she likes hung black men so you take her back to your place and she starts tying a noose,train,1,1,,1
37259,../FHM/img/37259.png,loyalty always has a cost some times it pays off and some times you take a loss,train,0,0,,0
48106,../FHM/img/48106.png,fuck islam,train,1,1,,1
19352,../FHM/img/19352.png,ain t nothing but a goat,train,0,0,,0
65213,../FHM/img/65213.png,what your ancestors were doing july what dummies do today for july th,train,0,0,,0
24368,../FHM/img/24368.png,ignorance and hate will lead you to nothing but shame,train,0,1,1,1
58426,../FHM/img/58426.png,when there is no pinyata at the party but the emo kid just hung himself improvise adapt overcome,train,0,0,,0
96785,../FHM/img/96785.png,lost african tribe,train,0,0,,0
40567,../FHM/img/40567.png,anne frank writing in her diary,train,0,0,,0
38625,../FHM/img/38625.png,a german ss soldier punishing a small jewish boy by sticking a sharpened spear in the boys anus auschwitz concentration camp poland colorized,train,1,1,,1
4823,../FHM/img/04823.png,definitely a new cultural era,train,0,0,,0
25368,../FHM/img/25368.png,when you suicide bomb an islamic mosque during a friday worship,train,1,1,,1
93826,../FHM/img/93826.png,my wife asked me where i d like to be buried apparently balls deep in your sister wasn t the answer she was expecting,train,0,1,1,1
56392,../FHM/img/56392.png,dick punch funny regardless of species,train,0,0,,0
30986,../FHM/img/30986.png,this beef is so raw its eating the salad,train,0,0,,0
75823,../FHM/img/75823.png,lisa page obama doj ordered fbi not to prosecute hillary clinton why is the mainstream media ignoring this bombshell,train,0,0,,0
84072,../FHM/img/84072.png,when you re fucking but wanna make sure he s not stealing anything,train,0,1,1,1
93147,../FHM/img/93147.png,replaced kitty litter with pop rocks,train,0,0,,0
92874,../FHM/img/92874.png,so convert to islam or die i say fuck it let s roll,train,1,1,,1
27946,../FHM/img/27946.png,cadbury s halal creme eggs now available in special edition,train,1,0,0,0
93614,../FHM/img/93614.png,i m sorry i left the seat up it won t happen again,train,0,0,,0
93521,../FHM/img/93521.png,ever notice that christians are bad drivers,train,1,0,0,0
2691,../FHM/img/02691.png,teaching them how to hunt young,train,0,0,,0
91708,../FHM/img/91708.png,when mohamed puts it inside,train,0,0,,0
25783,../FHM/img/25783.png,let s see if they get scared now bring they ass out here we will cut their heads off,train,0,1,1,1
16098,../FHM/img/16098.png,when you find out who s been eating your leftovers,train,0,0,,0
30452,../FHM/img/30452.png,trump supporters be like show me where he lied,train,0,0,,0
86491,../FHM/img/86491.png,you are not wanted you are a mental deficient,train,0,1,1,1
14530,../FHM/img/14530.png,it s a proven fact marines islamic radicals are less prone to violent acts after they ve been shot in the head,train,1,1,,1
81734,../FHM/img/81734.png,when instincts take over,train,0,0,,0
4683,../FHM/img/04683.png,when you make a meme using a different language that everyone can still understand no es mucho pero es trabajo honesto,train,0,0,,0
8593,../FHM/img/08593.png,years later,train,1,0,0,0
92608,../FHM/img/92608.png,says he alone is tough enough to defeat isis still too chickenshit to release his tax returns,train,0,1,1,1
61453,../FHM/img/61453.png,when you find the cake your mum was hiding from you,train,0,0,,0
39601,../FHM/img/39601.png,welcome refugees to poland s newest star hotel,train,0,0,,0
12035,../FHM/img/12035.png,i date crazy bikers with beards cause once you ride a beard and a harley you don t go back,train,0,0,,0
56482,../FHM/img/56482.png,heroin is destroying the white community keep up the good work heroin,train,1,1,,1
56287,../FHM/img/56287.png,and then i says to her no i got your nose,train,0,0,,0
19036,../FHM/img/19036.png,infamous,train,0,0,,0
34852,../FHM/img/34852.png,gee i d like to suicide bomb the crap out of that church but i got a thing at couldn t abdul do it,train,1,1,,1
62804,../FHM/img/62804.png,look at this throatagraph,train,0,0,,0
81579,../FHM/img/81579.png,the look your women gives you when you can t finsh the job,train,0,0,,0
80247,../FHM/img/80247.png,the pimp hand strong enough for man but made for teaching,train,0,0,,0
52890,../FHM/img/52890.png,wait this isn t my dog,train,0,0,,0
2485,../FHM/img/02485.png,real friendship is sending them a link to something terrible so you can both be traumatised at the same time i torture all my friends it s how i show love,train,0,0,,0
50793,../FHM/img/50793.png,a muslim in congress wants to get rid of homeland security let that sink in,train,0,1,1,1
13857,../FHM/img/13857.png,this is why we shoot you guys,train,0,1,1,1
43617,../FHM/img/43617.png,this chick can t stand fishing,train,0,0,,0
70942,../FHM/img/70942.png,lesbians should not be allowed to buy dildos you made your choice bitch now live with it,train,0,1,1,1
49601,../FHM/img/49601.png,when your fifth pet eats food from another guys hand,train,0,0,,0
35102,../FHM/img/35102.png,please be patient we creating a better fuckup for all,train,0,1,1,1
10659,../FHM/img/10659.png,chinese ppl be like happy thanksgiving,train,0,0,,0
36081,../FHM/img/36081.png,in this edition we don t buy property we steal it,train,1,0,1,1
68325,../FHM/img/68325.png,it happend mom a black guy gave me complement ohhh sweety i m so sorry that means you need to lose about pounds,train,1,0,0,0
39256,../FHM/img/39256.png,this isn t the way there s always a better way,train,0,0,,0
98362,../FHM/img/98362.png,it s ma am look i found a penis,train,1,0,0,0
38475,../FHM/img/38475.png,i don t always feel like i m at the top of the gene pool but when i do i m at walmart,train,0,0,,0
49083,../FHM/img/49083.png,when you catch your goat with another man ya done fucked up,train,0,1,1,1
45938,../FHM/img/45938.png,hey i just met you and this is crazy this is my grenade so blow me maybe,train,1,0,1,1
67823,../FHM/img/67823.png,as much as abdul tried he could not get the fucker into first gear,train,0,1,1,1
70928,../FHM/img/70928.png,when you drink and drive you will get busted,train,0,0,,0
