id,image,text,type,original_dataset_label,model_prediction,human_annotation,majority_voting
65124,../FHM/img/65124.png,hmmm who shall i arrest first brennan clapper comey or obama hillary first,train,0,1,1,1
46902,../FHM/img/46902.png,maybe energy drinks are like mana potions in real life,train,0,0,,0
85426,../FHM/img/85426.png,i need help swimming,train,0,0,,0
4798,../FHM/img/04798.png,are you bored join spastics with special admin powers now,train,0,0,,0
31897,../FHM/img/31897.png,toshiba i lost a friend on that beach,train,0,0,,0
93275,../FHM/img/93275.png,i m this pretty because both my parents are white,train,0,1,0,0
47618,../FHM/img/47618.png,when they say not to blink or you ll miss the magic trick,train,0,0,,0
81975,../FHM/img/81975.png,best thing about an ethiopian blowjob you know shes gonna swallow,train,0,1,1,1
85729,../FHM/img/85729.png,doesn t own a computer can still play minesweeper,train,0,0,,0
54917,../FHM/img/54917.png,out of the whole year we only need women for about days,train,0,0,,0
69158,../FHM/img/69158.png,i m not an asshole i m a hemorrhoid i irritate assholes,train,0,1,1,1
86451,../FHM/img/86451.png,i m here to drink whiskey and kill terrorists and brother i m all out of whiskey,train,0,1,1,1
10328,../FHM/img/10328.png,how dikes look when they re in line paying for their pads,train,1,0,0,0
71485,../FHM/img/71485.png,hurry ladies he s still luke warm,train,0,0,,0
71583,../FHM/img/71583.png,breaking news a zoo s chimpanzee escaped containment,train,0,0,,0
21403,../FHM/img/21403.png,let me be clear i am a treasonous piece of shit,train,0,1,1,1
95482,../FHM/img/95482.png,and then i said do i look like i give a fuck,train,0,1,1,1
79610,../FHM/img/79610.png,one does not simply walk into north korea,train,0,0,,0
76140,../FHM/img/76140.png,mexican and black jokes are all the same once you hear juan you here jamal,train,1,0,1,1
35917,../FHM/img/35917.png,i pictured a black girl naked today can i get an std from this,train,1,1,,1
1475,../FHM/img/01475.png,last time muslims invaded europe vlad stuck poles up their asses and made a fucking forest be like vlad,train,1,1,,1
49185,../FHM/img/49185.png,the face you make when your pussy gets hard,train,1,0,1,1
16480,../FHM/img/16480.png,israel we re coming for you next,train,0,1,1,1
20617,../FHM/img/20617.png,bruce jenner s cat,train,1,0,0,0
16058,../FHM/img/16058.png,if you re gonna go boating make sure you have the proper flotation devices,train,0,0,,0
70849,../FHM/img/70849.png,head teachers given the power to ban the burqa in british schools share if you want a full ban in britain,train,0,1,1,1
78306,../FHM/img/78306.png,the hardcore way to eat ramen noodles boil water eat block of ramen drink boiled water snort flavored powder fuck bitches,train,0,1,1,1
97623,../FHM/img/97623.png,tattoos are bad for your health i know million people who had tattoos and they all died,train,1,1,,1
92314,../FHM/img/92314.png,the difference between you and hitler at least hitler could use an oven,train,1,0,1,1
52406,../FHM/img/52406.png,do you shop at wal mart did you vote for trump you might be white trash,train,0,1,1,1
71230,../FHM/img/71230.png,the enemy within ilhan omar linda sarsour rashida tlaib ocasto cortez,train,0,1,1,1
90786,../FHM/img/90786.png,so where did you get all of this gold elizabeth i stole it from africa,train,1,1,,1
62458,../FHM/img/62458.png,happy and in love,train,0,0,,0
40137,../FHM/img/40137.png,muslims moved in but theyre not moving out,train,0,0,,0
38069,../FHM/img/38069.png,morgan freeman morgan not so freeman,train,0,0,,0
20819,../FHM/img/20819.png,after a hard day of work mohammed is very tired,train,0,0,,0
20163,../FHM/img/20163.png,i am your equal spend money on me,train,0,0,,0
50248,../FHM/img/50248.png,long story short askies age restriction okay,train,0,0,,0
83619,../FHM/img/83619.png,i went to school and nikker cheated ahh fuck,train,1,1,,1
26459,../FHM/img/26459.png,do you like kids because i m going to turn your mouth into a daycare,train,0,0,,0
30412,../FHM/img/30412.png,japanese fashion trends,train,0,0,,0
97035,../FHM/img/97035.png,put n the ham in mohamed,train,1,0,0,0
74602,../FHM/img/74602.png,this is what happens when you don t spank your kids,train,0,1,1,1
93650,../FHM/img/93650.png,i got kicked out of hogwarts for using black magic,train,0,0,,0
95742,../FHM/img/95742.png,you know like when the tv doesn t work you give it a hard hit and then its all better,train,0,0,,0
93410,../FHM/img/93410.png,i made a website for orphans it doesn t have a home page,train,0,0,,0
75203,../FHM/img/75203.png,i only wear silk panties cotton ones remind me of slavery,train,1,1,,1
54286,../FHM/img/54286.png,thank god my ass needed a break,train,0,0,,0
2841,../FHM/img/02841.png,birthday because i don t care if it s happy,train,0,0,,0
93076,../FHM/img/93076.png,should i call a plumber or a electrician,train,0,0,,0
89407,../FHM/img/89407.png,puts on sunblock doesn t protect from harmful rays,train,0,0,,0
65728,../FHM/img/65728.png,look son a dipshit that just made a nonpolitical post into a political one,train,0,1,1,1
75841,../FHM/img/75841.png,why does the goat look wiser,train,0,0,,0
38624,../FHM/img/38624.png,not my president not my residents,train,1,0,0,0
36187,../FHM/img/36187.png,mama i just killed a man,train,0,0,,0
47095,../FHM/img/47095.png,mandatory vaccinations without exemptions i do nazi see the problem,train,1,1,,1
51746,../FHM/img/51746.png,we should all be like muslims and not eat pork bc pigs are too cute,train,0,1,1,1
32876,../FHM/img/32876.png,those are some clean burning jews i tell ya h wat,train,1,1,,1
21408,../FHM/img/21408.png,i m uncertain where i stand on abortion i like killing babies but hate the idea of giving women a choice,train,1,1,,1
64513,../FHM/img/64513.png,yo dawg i heard you loved chinese food so i ordered take out,train,0,0,,0
10527,../FHM/img/10527.png,when you finally headshot black people,train,0,1,1,1
45891,../FHM/img/45891.png,so your not a whore half a gram says you are,train,0,1,1,1
21096,../FHM/img/21096.png,heartbreaking i weep for limp dicks everyday,train,0,1,1,1
57043,../FHM/img/57043.png,life handed me lemons so i fucked them and gave them lemon aids,train,0,1,1,1
85413,../FHM/img/85413.png,they did not even leave dogs,train,0,0,,0
6392,../FHM/img/06392.png,don t forget guys may is buy your wife a new gun month,train,0,0,,0
97316,../FHM/img/97316.png,pulls pizza out of oven everyone else at auschwitz,train,1,0,0,0
47290,../FHM/img/47290.png,there are three types of girls,train,0,0,,0
3971,../FHM/img/03971.png,so i was sucking on her t ts then the husband walks in and i just sk t myself,train,0,1,1,1
65237,../FHM/img/65237.png,showing skin since you don t have anything else to offer,train,0,1,1,1
53017,../FHM/img/53017.png,children trying to stay cool in the water,train,0,0,,0
13769,../FHM/img/13769.png,my goal for is to accomplish the goals of which i should have done in because i promised them in and planned them in,train,0,0,,0
73258,../FHM/img/73258.png,talk about everything is better in two s,train,0,0,,0
90278,../FHM/img/90278.png,when your fifth wife eats grass from another guys hand,train,1,0,1,1
34186,../FHM/img/34186.png,when i was a kid i thought black people were made from anal sex,train,1,1,,1
70594,../FHM/img/70594.png,where s this bird box everyone s taking about,train,0,0,,0
74019,../FHM/img/74019.png,enjoying new loungewear when it s chilly outside,train,0,0,,0
34581,../FHM/img/34581.png,teacher dont make any explosives inside the lab le mohammed,train,1,0,1,1
13486,../FHM/img/13486.png,oh look it s the wetern feminist movement when it comes to islam and sharia law,train,1,1,,1
18607,../FHM/img/18607.png,my girlfriend said no more sex in our bed until you put a ring on it i really hope that she likes it,train,0,0,,0
36048,../FHM/img/36048.png,this would be racist if black people could read,train,0,0,,0
16283,../FHM/img/16283.png,pork is unclean ever smell one of these goat fuckers,train,0,1,1,1
72058,../FHM/img/72058.png,i went to ride my bike today,train,0,0,,0
70315,../FHM/img/70315.png,i am a test dummy,train,0,0,,0
49076,../FHM/img/49076.png,i want your feet to be my kid s jannah,train,0,0,,0
98351,../FHM/img/98351.png,each oven could only burn less than bodies per year or the metal would fracture tone,train,1,0,0,0
57164,../FHM/img/57164.png,i don t think abortion is wrong if i was raped i wouldn t won t some black baby in me either,train,1,1,,1
35460,../FHM/img/35460.png,when someone tries to rape you but you rape him instead improvise adapt overcome,train,0,0,,0
69342,../FHM/img/69342.png,starving mexican monkey eating peanuts,train,1,0,0,0
63295,../FHM/img/63295.png,why isn t my drain working probably cause the pipe s black,train,1,0,0,0
87504,../FHM/img/87504.png,white girls stepped their game up,train,0,1,1,1
85614,../FHM/img/85614.png,why the fuck is this not already a meme,train,0,1,1,1
18650,../FHM/img/18650.png,i am not gay i am a man who turned into a woman after a bee sting and now i am attracted to men rellly trust me,train,1,0,0,0
83014,../FHM/img/83014.png,hahaha fuck you bitch,train,0,1,1,1
41986,../FHM/img/41986.png,they want this because they found love in eachother,train,0,0,,0
50867,../FHM/img/50867.png,the name s todd retodd,train,1,0,0,0
51092,../FHM/img/51092.png,how do you make a yr old cry twice wipe your bloody cock off on their teddy bear,train,0,1,1,1
20945,../FHM/img/20945.png,grabbing guns because criminals have too many is like castrating yourself because your neighbor has too many kids,train,0,0,,0
91562,../FHM/img/91562.png,meanwhile at the isis strip club,train,0,1,1,1
81720,../FHM/img/81720.png,let s go staring contest,train,0,0,,0
78031,../FHM/img/78031.png,what s the worst part of being black and jewish having to sit at the back of the gas chamber that s reich,train,1,1,,1
84351,../FHM/img/84351.png,we cannot arm teachers it violates the rights of the shooter,train,0,0,,0
69078,../FHM/img/69078.png,why did god create them so they could understand each other and hate each other,train,0,0,,0
58463,../FHM/img/58463.png,what you really mean when you say your going to the bathroom,train,0,0,,0
5123,../FHM/img/05123.png,when cops question someone who just got robbed did anything seem strange like maybe something black,train,1,0,0,0
53924,../FHM/img/53924.png,mom can you mash the vegies me,train,0,0,,0
90481,../FHM/img/90481.png,dear girls before you call a guy ugly just remember he does not wear make up,train,0,0,,0
30847,../FHM/img/30847.png,when you get caught jacking off to the snapchat girl filter of yourself that wasn t me that was patricia,train,1,0,1,1
71392,../FHM/img/71392.png,men are like dogs we re excited to see you and have no clue what you re mad about,train,0,0,,0
25640,../FHM/img/25640.png,when you and your squad rest after a long day protesting trump,train,0,0,,0
52931,../FHM/img/52931.png,i swear i put sunscreen on,train,0,0,,0
50461,../FHM/img/50461.png,say cheese photobomb,train,0,0,,0
83941,../FHM/img/83941.png,largest drug bust in u s history tons of crack,train,0,1,1,1
70654,../FHM/img/70654.png,future sex slaves welcome their muslim masters,train,1,1,,1
71398,../FHM/img/71398.png,hundreds have gathered at a volkswagen owners meet up according to nasa the glow from their check engine lights could be seen from space,train,0,0,,0
37182,../FHM/img/37182.png,i may be blind but at least i m not black,train,1,1,,1
48920,../FHM/img/48920.png,hello my lgbtq friends it s pride month so free shots for everyone,train,0,0,,0
6439,../FHM/img/06439.png,back to the hall of fame th annual rock and roll,train,0,0,,0
5798,../FHM/img/05798.png,when they become besties over the same dude,train,0,0,,0
59261,../FHM/img/59261.png,i wanna see the most fucked up meme lets see what you got,train,0,1,1,1
9831,../FHM/img/09831.png,when someone says show me in the bible where it says jesus command gays should be out to death leviticus,train,1,0,1,1
75138,../FHM/img/75138.png,what does a baby from auschwitz look like,train,1,0,1,1
35412,../FHM/img/35412.png,treason anti american democrat adam schiff funded by america hating george soros,train,0,1,1,1
89170,../FHM/img/89170.png,canadian border jumper detained by american patriot,train,0,0,,0
30276,../FHM/img/30276.png,when the dishwasher isn t working properly and you have no tecnical knowledge whatsoever so you just decide to talk to it and hope it starts working good luck,train,0,0,,0
81263,../FHM/img/81263.png,who you are inside matters more than how you want others to see you,train,0,0,,0
32089,../FHM/img/32089.png,red wine that s a lifestyle choice,train,0,0,,0
92081,../FHM/img/92081.png,this is a snakes mouth it all makes fucking sense now,train,0,1,1,1
71052,../FHM/img/71052.png,when the teacher leaves the room and the retarded kid puts his dick in the pencil sharpener,train,1,1,,1
45960,../FHM/img/45960.png,has more skeletons in her closet than jeffrey dahmer,train,0,0,,0
19630,../FHM/img/19630.png,i enjoyed watching the king kong movie,train,0,0,,0
18275,../FHM/img/18275.png,instead of being born again why not just grow up,train,0,0,,0
45836,../FHM/img/45836.png,abyssynian slaves in iron collars,train,0,1,1,1
87610,../FHM/img/87610.png,i only wear silk panties cotton ones remind me of slavery,train,0,1,1,1
82154,../FHM/img/82154.png,when you ask the jewish girl for her number and she starts rolling up her sleeve,train,1,0,1,1
49128,../FHM/img/49128.png,have you ever tired ethiopian food they say its delicious,train,0,0,,0
73652,../FHM/img/73652.png,if trump isn t hitler then i m i m a moron well i m certainly not gonna argue with that,train,0,1,1,1
7124,../FHM/img/07124.png,how to wink at a muslim,train,0,0,,0
45780,../FHM/img/45780.png,you think your day was bad these two didn t get accepted to the same college,train,0,0,,0
58301,../FHM/img/58301.png,it hurts the poor muslim s feelings well whoopty doo this aint arabia meathead,train,0,1,1,1
86907,../FHM/img/86907.png,i came to fingerpaint and fuck and im all out of poop,train,0,1,1,1
45291,../FHM/img/45291.png,no more tears next time walk do not run,train,0,0,,0
50473,../FHM/img/50473.png,if you think the crakkka of today is different from the crakka years ago you re a damn fool,train,0,1,1,1
89475,../FHM/img/89475.png,when you re not fit but you know you re still majestic af,train,0,0,,0
2769,../FHM/img/02769.png,think we just discovered cop crack bacon wrapped donuts mother of god,train,0,0,,0
13964,../FHM/img/13964.png,this isn t even my final form,train,0,0,,0
15690,../FHM/img/15690.png,muslims when someone uses kilometres per hour instead of wifes per child sex slaves,train,1,1,,1
6239,../FHM/img/06239.png,cameraman i don t understan psychic kid trust me this will be really funny someday,train,0,0,,0
94678,../FHM/img/94678.png,no one steven hawking,train,0,0,,0
39164,../FHM/img/39164.png,beheaded shot and stoned to death trans people killed this year you gotta pump those numbers up those are rookie numbers,train,1,1,,1
71839,../FHM/img/71839.png,let me be perfectly clear i will never stop lying to you suckers,train,0,1,1,1
74861,../FHM/img/74861.png,i got back with my ex box,train,0,0,,0
80532,../FHM/img/80532.png,lovely couch you have here it d be a shame if someone were to shit on it,train,0,1,1,1
57861,../FHM/img/57861.png,i m proud to be rude and crude and crass i m proud to be a redneck piece of white trash,train,1,1,,1
20134,../FHM/img/20134.png,bro u dont watch idubbbz bro thats kinda cringe,train,0,0,,0
96531,../FHM/img/96531.png,parents will lie to their children about why they celebrate thanks giving christmas easter and holloween they have the nerve to tell the children don t you ever lie to me,train,0,1,1,1
6798,../FHM/img/06798.png,news from th century,train,0,0,,0
62017,../FHM/img/62017.png,fidget spinner for woman,train,0,0,,0
92157,../FHM/img/92157.png,when you are that ugly you don t have a choice,train,0,1,1,1
63702,../FHM/img/63702.png,assad my son is smarter than yours lol hamid,train,0,0,,0
58326,../FHM/img/58326.png,everyone is excited for the baby to come,train,0,0,,0
82356,../FHM/img/82356.png,the numbers are supposed to go down not up,train,1,0,0,0
37250,../FHM/img/37250.png,oh boy i hope i get out of here so i can go home and check on my dog,train,0,0,,0
24197,../FHM/img/24197.png,kenyan shit,train,1,1,,1
69018,../FHM/img/69018.png,when you slap your dishwasher too hard,train,0,0,,0
90582,../FHM/img/90582.png,worst pijama party ever,train,0,0,,0
92146,../FHM/img/92146.png,without the wall copied to clipboard this is what we get,train,0,0,,0
83074,../FHM/img/83074.png,if you re gonna screenshot a meme at least crop out the black space,train,0,0,,0
75210,../FHM/img/75210.png,yeah i hear you i just don t give a fuck,train,0,1,1,1
8259,../FHM/img/08259.png,old yearbook photo of a cute child,train,0,0,,0
26930,../FHM/img/26930.png,african american leaders organizing the la riots april,train,0,0,,0
75410,../FHM/img/75410.png,so you re telling me that black people stole the n word from white people typical,train,1,1,,1
72456,../FHM/img/72456.png,dumbass fucking white people marking up the internet with their opinions like dogs pissing on fire hydrants sarah jeong nyt editor the new york times,train,1,1,,1
80347,../FHM/img/80347.png,i wanna see the most fucked up meme lets see what you got,train,0,1,1,1
67319,../FHM/img/67319.png,happy birthday sister,train,0,0,,0
53678,../FHM/img/53678.png,which jewish girl is hotter,train,1,0,0,0
57029,../FHM/img/57029.png,hey i just met you and this is crazy this is my mad face so i might be angry,train,0,0,,0
71826,../FHM/img/71826.png,white people dont shoot eachother in the streets like black people do we do it in schools because we have class,train,1,1,,1
89573,../FHM/img/89573.png,you out of the gene pool now,train,0,1,1,1
67402,../FHM/img/67402.png,i like my rice crispy please,train,0,0,,0
65139,../FHM/img/65139.png,they told me i would miss my family i never miss at close range,train,1,0,0,0
36597,../FHM/img/36597.png,white people after shots black people after shots,train,0,0,,0
67852,../FHM/img/67852.png,he asked me if its permissible to smoke marijuana in muslim country so i told him in our contries only gays get stoned,train,1,1,,1
40217,../FHM/img/40217.png,years on the job million jobs gained month on the job jobs lost,train,0,0,,0
86143,../FHM/img/86143.png,how can i get dat percap,train,0,0,,0
24130,../FHM/img/24130.png,true strength comes from within,train,0,0,,0
93671,../FHM/img/93671.png,no no man shit no man i believe you get your ass kicked saying some sumthin like that man,train,0,1,1,1
7615,../FHM/img/07615.png,i put the ape in rape,train,0,1,1,1
36581,../FHM/img/36581.png,russian flag,train,0,0,,0
98032,../FHM/img/98032.png,we can do it best,train,0,0,,0
91738,../FHM/img/91738.png,i m just gon sit here mind my business,train,0,0,,0
53241,../FHM/img/53241.png,i support terrorists because they re pea brains like me,train,0,1,1,1
13249,../FHM/img/13249.png,here s a little song i call the talmudists are planning to kill us all,train,1,0,1,1
94361,../FHM/img/94361.png,when you can t wait for them to cut the cake,train,0,0,,0
51768,../FHM/img/51768.png,alright i m going to let go now,train,0,0,,0
58029,../FHM/img/58029.png,i don t always roll a joint but when i do it s my ankle,train,0,0,,0
20379,../FHM/img/20379.png,bitches be like at the beach with my besties,train,1,0,0,0
75698,../FHM/img/75698.png,what the fuck am i looking at,train,0,1,1,1
29063,../FHM/img/29063.png,when people say you have an explosive personality,train,0,0,,0
80341,../FHM/img/80341.png,says he s going to destroy isis too scared to speak in chicago,train,0,0,,0
45036,../FHM/img/45036.png,once a year women go completely crazy for about days,train,0,0,,0
9265,../FHM/img/09265.png,take advantage of u n and foreign aid funded housing and benefits death to the west,train,0,1,1,1
19458,../FHM/img/19458.png,carribbean women,train,0,0,,0
71403,../FHM/img/71403.png,half my problems are caused by my tone of voice sarcasm everyone thinks i m either mad arguing or just an asshole while actually i m just talking,train,0,0,,0
94062,../FHM/img/94062.png,the look after you told your mom you cleaned your room,train,0,0,,0
6197,../FHM/img/06197.png,want proof firefighters do it better ask a police officer s wife,train,0,0,,0
56274,../FHM/img/56274.png,when she on top you trynna catch a titty,train,0,1,1,1
63952,../FHM/img/63952.png,on the way to go play,train,0,0,,0
92546,../FHM/img/92546.png,extremist are brain washing the children,train,0,1,1,1
92436,../FHM/img/92436.png,even if you cut your penis you will never be a woman,train,1,1,,1
98573,../FHM/img/98573.png,six years kid i want to be an architecht when i grow up cancer i m about to end this man s whole career,train,1,0,1,1
15078,../FHM/img/15078.png,when abortion is illegal so you become an anti vax parent improvise adapt overcome,train,0,0,,0
70384,../FHM/img/70384.png,all these flavors and you choose to be salty,train,0,0,,0
83219,../FHM/img/83219.png,normal people black squirrel me squigga,train,1,0,0,0
51489,../FHM/img/51489.png,did you know that the chinese eat dogs disgusting savages,train,0,1,1,1
7215,../FHM/img/07215.png,dogs are cute great compantions and can be taught to obey and protect a better option than a gun,train,0,0,,0
30687,../FHM/img/30687.png,slipped and hit the bathtub now everyone is asking if things are okay at home,train,0,0,,0
73251,../FHM/img/73251.png,i have no idea how to do your job but my book says you re doing it wrong,train,0,0,,0
52340,../FHM/img/52340.png,how i feel after the all you can eat buffett,train,0,0,,0
28604,../FHM/img/28604.png,and then they said what about the irish slaves,train,1,0,1,1
7312,../FHM/img/07312.png,yeah bitches totalinarism is a sham,train,0,1,1,1
80217,../FHM/img/80217.png,ready for a king of the hill marathon,train,0,0,,0
6893,../FHM/img/06893.png,you rape em we scrape em no fetus can defetus,train,1,1,,1
93068,../FHM/img/93068.png,hi i m the electrician i m here to remove your shorts and check your box,train,0,0,,0
53184,../FHM/img/53184.png,back in my day blowing a tranny meant car trouble,train,0,0,,0
2947,../FHM/img/02947.png,meanwhile at the isis strip club,train,0,1,1,1
6153,../FHM/img/06153.png,i had a bad dream about the ku klux klan,train,0,1,1,1
94850,../FHM/img/94850.png,meanwhile at the isis strip club,train,0,1,1,1
32750,../FHM/img/32750.png,william shatner has discontinued his new line of ladies lingerie apparently shatner panties wasn t the best choice for a name,train,0,0,,0
81953,../FHM/img/81953.png,musslamic democrat ilhan omar has threatend members of congress she s told several republicans that shel ll send them shawarma to give them a taste of her culture share to say arrest her now,train,0,1,1,1
58091,../FHM/img/58091.png,hotline to allah pull pin hold to ear then wait for dial tone,train,1,0,1,1
98256,../FHM/img/98256.png,i told a girl to text me when she got home she must be homeless,train,0,1,1,1
54319,../FHM/img/54319.png,emperor haile selassie i world tour a k a ethiopia on the march,train,1,0,0,0
94360,../FHM/img/94360.png,how to get a black guy to see his baby,train,1,0,0,0
54692,../FHM/img/54692.png,been talking shit about trump since day one now crying like bitches after getting called out,train,0,1,1,1
1642,../FHM/img/01642.png,this would be racist if black people could read,train,1,0,0,0
46150,../FHM/img/46150.png,i m not any different,train,0,0,,0
19438,../FHM/img/19438.png,when dudes try to be funny at the club i m sorry is this some sort of peasant joke that i m too rich to understand,train,0,1,1,1
45730,../FHM/img/45730.png,the last thing a tr nsexual sees before it gets sent to hell,train,1,1,,1
30792,../FHM/img/30792.png,ultimate terrorist lure position decoy and wait,train,0,0,,0
83901,../FHM/img/83901.png,am i gonna wish you happy birthday dafuq else im a do,train,0,1,1,1
23705,../FHM/img/23705.png,my liberal privilege liberal privilege kept me out of prison,train,0,0,,0
49806,../FHM/img/49806.png,a group of men,train,0,0,,0
40813,../FHM/img/40813.png,oh look he already has an arrest warrant,train,0,0,,0
1468,../FHM/img/01468.png,assad my son exploded better than yours lol hamid,train,0,0,,0
10589,../FHM/img/10589.png,i love coke more than pepsi,train,0,0,,0
70132,../FHM/img/70132.png,i am peacful don t believe me then i will blow you up,train,0,1,1,1
65319,../FHM/img/65319.png,when you forget who you are you too forget who they are,train,0,0,,0
36281,../FHM/img/36281.png,everyone wants me to read the constitution but it s written in cursive,train,0,0,,0
83965,../FHM/img/83965.png,bitch shut your ugly crack addict looking poor white trash ass up,train,1,1,,1
30156,../FHM/img/30156.png,when you re still alive after years of destructive alcohol and drug abuse life uh finds a way,train,0,0,,0
61450,../FHM/img/61450.png,be fake just to fit in i can t my life was hard i been through to much real shit,train,0,1,1,1
21078,../FHM/img/21078.png,i didn t say i wanted to hang the gays i said i prefer gay men to be hung,train,1,1,,1
65914,../FHM/img/65914.png,good morning,train,0,0,,0
28637,../FHM/img/28637.png,instead of being born again why not just grow up,train,0,0,,0
92067,../FHM/img/92067.png,you will never see refugees from america when things turn to shit we don t run to another country we dust off our guns and fix it,train,0,1,1,1
13652,../FHM/img/13652.png,dad does wanking give you big muscles i don t know son but don t stop now i m about to cum,train,1,1,,1
80197,../FHM/img/80197.png,former first lady during an interview,train,0,0,,0
47601,../FHM/img/47601.png,the difference between moderate muslim and radical muslim follow my allah or i kill you radical muslim follow my allah or he kill you moderate muslim,train,1,1,,1
86713,../FHM/img/86713.png,i fuck goats allah is great,train,1,1,,1
70329,../FHM/img/70329.png,i m not gay but for you can ramit inmah ashol,train,0,1,1,1
