id,image,text,type,original_dataset_label,model_prediction,human_annotation,majority_voting
45197,../FHM/img/45197.png,that look when you find out the fbi is after you and michelle obama ain t answering her phone no more,train,0,1,1,1
83095,../FHM/img/83095.png,what no i am not asian,train,1,0,0,0
27461,../FHM/img/27461.png,so you think we should import muslims did your grandfather import nazis,train,1,1,,1
35740,../FHM/img/35740.png,is it legal to masturbate to pictures of yourself as a child,train,0,1,1,1
80425,../FHM/img/80425.png,the guy who created the joke the jokers,train,0,0,,0
74901,../FHM/img/74901.png,there are many things i need to tell you,train,0,0,,0
93152,../FHM/img/93152.png,don t blame me fuel was expensive,train,0,0,,0
34671,../FHM/img/34671.png,look it says it right here we can fuck goats,train,0,1,1,1
98571,../FHM/img/98571.png,every year a million people get sick from eating tainted beef who the fuck is putting their taint on the beef,train,0,1,1,1
20195,../FHM/img/20195.png,when you dont stir the nesquick powder in your milk enough,train,1,0,0,0
5813,../FHM/img/05813.png,roses are red candles drip wax breaking news man tries to trade kidnapped baby for big macs,train,0,0,,0
43185,../FHM/img/43185.png,it s obvious that he s thinking about another girl i can t believe that the lamb s bride has been the new jerusalem this whole time,train,0,0,,0
3615,../FHM/img/03615.png,joke time muslims walk into a bar,train,0,1,1,1
5148,../FHM/img/05148.png,the hardest part of breaking up with a japanese girlfriend is having to drop the bomb on her twice before she gets it,train,1,0,0,0
41679,../FHM/img/41679.png,let me play with the muslims,train,1,0,1,1
93852,../FHM/img/93852.png,happiness happens when we stand together,train,0,0,,0
68941,../FHM/img/68941.png,an australian man kills people in new zealand arv and the main stream media blames trump,train,0,1,1,1
65931,../FHM/img/65931.png,hey me and ze boys are throwing a kegger at ze moon tower all reich all reich all reich,train,0,1,1,1
17948,../FHM/img/17948.png,faceswap ching chong,train,1,0,1,1
51708,../FHM/img/51708.png,i offered her a penny for her thoughts she gave me change,train,0,0,,0
31029,../FHM/img/31029.png,when there is no pinyata at the party but the emo kid just hung himself improvise adapt overcome,train,0,0,,0
91052,../FHM/img/91052.png,life is hard it s harder when you re stupid,train,1,0,0,0
10463,../FHM/img/10463.png,so where did you get all of this gold elizabeth i stole it from africa,train,0,1,1,1
57490,../FHM/img/57490.png,oh you decided not to use a condom tell me more why it s her falt that you got chlamydia,train,0,1,1,1
76924,../FHM/img/76924.png,in norway we work after dinner,train,0,0,,0
81294,../FHM/img/81294.png,lmco laugh my cock off,train,1,0,1,1
47569,../FHM/img/47569.png,what is that wonderful smell it smells like caramel oh today we burnt the diabetics,train,1,0,0,0
75209,../FHM/img/75209.png,sea monkeys,train,1,0,0,0
82603,../FHM/img/82603.png,felt cute might go sit down to pee idk,train,1,0,0,0
61527,../FHM/img/61527.png,handjobs sold seperately,train,0,0,,0
41087,../FHM/img/41087.png,when i see people who post punch a nazi in person im a nazi gregg are you gonna punch me,train,0,1,1,1
91845,../FHM/img/91845.png,kids enjoying some underwater diving,train,0,0,,0
56128,../FHM/img/56128.png,jewish prisoners after being liberated by the ussr auschwitz colorized,train,1,0,0,0
24395,../FHM/img/24395.png,when you are excited that a muslim has made it into american politics so the next phase of the caliphate can begin and destroy western civilization but you realize it is a woman,train,1,1,,1
18236,../FHM/img/18236.png,shoot boy i ain t racist i ve got four black tires and a color tv,train,0,0,,0
42056,../FHM/img/42056.png,kill all niggers white power,train,1,1,,1
74890,../FHM/img/74890.png,when the dishwasher isn t working properly and you have no tecnical knowledge whatsoever so you just decide to talk to it and hope it starts working good luck,train,1,0,0,0
40759,../FHM/img/40759.png,jew jerky leave out in the sun until all moisture is gone store in a cool dark place for days,train,0,0,,0
51476,../FHM/img/51476.png,bernie couldn t be more excited for his first day as a police officer he outright refused to accept his paycheck insisting that being able to legally shoot black children is payment enough,train,1,1,,1
86071,../FHM/img/86071.png,when the deaf kids are roasting you in sign language so you turn off the lights it s a simple spell but quite unbreakable,train,1,0,0,0
41037,../FHM/img/41037.png,been here months gets wk from the government been here generations gets loan to be repaid in full from the government,train,1,0,0,0
17965,../FHM/img/17965.png,changing every single country it touches,train,0,0,,0
64870,../FHM/img/64870.png,they elect their enemy to rule over them stupid americans,train,1,1,,1
76285,../FHM/img/76285.png,when you re picking cotton as fast as your ashy hands can and then you hear your master crack his whip,train,1,0,1,1
5672,../FHM/img/05672.png,i pushed my life alert necklace now i m waiting on those sexy emt guys to show up,train,0,0,,0
57926,../FHM/img/57926.png,girls be like i hate when guys stare at me at the gym,train,0,0,,0
95064,../FHM/img/95064.png,hey this bag only weighs it s graam,train,0,0,,0
87409,../FHM/img/87409.png,i m going trans hunting,train,1,0,0,0
9382,../FHM/img/09382.png,you ve been hungerstruck,train,0,0,,0
84629,../FHM/img/84629.png,not a runner now you are,train,0,0,,0
13986,../FHM/img/13986.png,this one time at camp we got so baked,train,0,0,,0
72964,../FHM/img/72964.png,thank you so much ariana grande you re welcome,train,0,0,,0
73205,../FHM/img/73205.png,when you get a fish and just stare at it through the fish tank,train,0,0,,0
28610,../FHM/img/28610.png,a head diaper is required when you have shit for brains,train,1,0,1,1
67312,../FHM/img/67312.png,the s to see the greatest band live in concert s to see a laptop live,train,0,0,,0
17536,../FHM/img/17536.png,when you finally meet a girl that can make you bust from head please may i have some more,train,0,0,,0
43190,../FHM/img/43190.png,i don t know man i just i just wanna dance,train,0,0,,0
47518,../FHM/img/47518.png,my sandwich maker is very slow today,train,1,0,0,0
92768,../FHM/img/92768.png,police training only shoot the black,train,1,1,,1
45208,../FHM/img/45208.png,when your vegan boyfriend tries to change a flat tire,train,0,0,,0
56917,../FHM/img/56917.png,the media is appalled by threats to her both have been threatened the media applauds all threats to him,train,0,1,1,1
7916,../FHM/img/07916.png,theleft will never condemn sharia law the muslim vote matters more to them than preserving the constitution,train,0,1,1,1
41869,../FHM/img/41869.png,him gonna beat dat pussy into mashed potatoes her im down,train,1,1,,1
75290,../FHM/img/75290.png,likes to play games with friends favorite game is called child soldiers,train,1,1,,1
18052,../FHM/img/18052.png,when you re looking cute as hell at the gym,train,0,0,,0
3296,../FHM/img/03296.png,come on over i m having a party the place is crawling with pussy,train,0,1,1,1
3268,../FHM/img/03268.png,hey mom the goats asshole is inside out what do,train,0,1,1,1
46238,../FHM/img/46238.png,one does not simply believe it s not butter,train,0,0,,0
40716,../FHM/img/40716.png,when someone thinks it s okay to fuck with you b c they think you re all love light i will stab u in the neck susan,train,0,1,1,1
74061,../FHM/img/74061.png,when ancestry com tells me that i m german rev up those fryers,train,1,0,0,0
51387,../FHM/img/51387.png,wing wing wing,train,1,0,0,0
30527,../FHM/img/30527.png,look ma no hands,train,1,0,0,0
78345,../FHM/img/78345.png,you wanna pet me i d pet me i d pet me hard,train,0,0,,0
85132,../FHM/img/85132.png,seems like u have a case of being a lil bitch i m prescribing you a heavy dose of man the fuck up,train,0,1,1,1
35048,../FHM/img/35048.png,god does not make people homosexuals or transgendered or sinners of any kind sin in fallen humanity does,train,1,0,0,0
65741,../FHM/img/65741.png,where s jaws when you need him,train,1,0,0,0
52761,../FHM/img/52761.png,attention ladies it s football season bring him a sammich get him a beer get a hobby stfu til valentine s day,train,0,0,,0
47531,../FHM/img/47531.png,yes i have changed i realized i was fucking up and changes had to be made,train,0,0,,0
58476,../FHM/img/58476.png,how to cook turkey in usa how to cook turkey in romania,train,0,0,,0
97805,../FHM/img/97805.png,anytime my dog growls at me excuse the shit out of my goddamn french but did you just threaten me,train,0,1,1,1
89245,../FHM/img/89245.png,these cute head tilts,train,1,0,0,0
4918,../FHM/img/04918.png,why do asians have eyes like this isn t it hard to see,train,0,0,,0
71086,../FHM/img/71086.png,im arrested and im in trouble,train,0,0,,0
84620,../FHM/img/84620.png,this is nahir nahir is born in germany nahir is german this is fluffy fluffy is born in horse stable fluffy is a horse,train,1,0,0,0
35671,../FHM/img/35671.png,jews exist hitler there s enough goofy gas for everyone,train,1,1,,1
49178,../FHM/img/49178.png,no wig no weave challenge,train,0,0,,0
70562,../FHM/img/70562.png,indian accent finally finding the right tutorial you need,train,0,0,,0
60134,../FHM/img/60134.png,if a dike started dating a tranny god can t be mad because it s still a relationship between a man and a woman,train,1,1,,1
35640,../FHM/img/35640.png,say it with me folks radical liberal terrorism,train,0,1,1,1
58674,../FHM/img/58674.png,when cops see an unarmed black youth,train,0,0,,0
8641,../FHM/img/08641.png,caitlyn jenner is kylie jenners transexual biological father,train,0,1,0,0
54038,../FHM/img/54038.png,old times were brutal,train,0,1,1,1
37284,../FHM/img/37284.png,the difference between moderate muslim and radical muslim follow my allah or he kill you moderate muslim follow my allah or i kill you radical muslim,train,1,1,,1
87263,../FHM/img/87263.png,trump the messiah of white trash racists,train,1,1,,1
84209,../FHM/img/84209.png,what if the government funded adoptions instead of abortions,train,0,0,,0
31406,../FHM/img/31406.png,stephen hawking defended the use of animals is medical research,train,0,0,,0
74198,../FHM/img/74198.png,big bird scolds the negores for even daring to think that they were allowed to ride on a bus,train,1,1,,1
70851,../FHM/img/70851.png,feeling cute might fuck a tranny later idk,train,0,1,1,1
49618,../FHM/img/49618.png,if elected i will institute gun control by executive action well i was going to say that you just blew your chances but then i remembered that s how you got started in politics,train,0,0,,0
79823,../FHM/img/79823.png,redneck word of the day inhale why inhale did i go to walmart today,train,1,0,0,0
61347,../FHM/img/61347.png,a few minutes after eating taco bell,train,0,0,,0
50286,../FHM/img/50286.png,in norway we rape after dinner,train,1,1,,1
21936,../FHM/img/21936.png,the best revenge is leaving somebody completely tf alone,train,0,0,,0
79280,../FHM/img/79280.png,manual tranny automatic tranny rebuilt tranny,train,0,0,,0
28639,../FHM/img/28639.png,boobs when you re home alone and lonely,train,0,0,,0
34698,../FHM/img/34698.png,when a spider runs across the carpet fucking smash it,train,0,1,1,1
71380,../FHM/img/71380.png,we should learn from ocean how to treat refugees,train,0,0,,0
32549,../FHM/img/32549.png,look out here comes the master race,train,1,1,,1
83025,../FHM/img/83025.png,but i m israeli god promised me the car,train,1,0,1,1
29463,../FHM/img/29463.png,i swear some people were conceived through anal sex because there s no way being that much of an asshole is natural,train,0,1,1,1
49725,../FHM/img/49725.png,i pull up in this and yell come on we got some redneck sh t to do are you getting in,train,0,1,1,1
58176,../FHM/img/58176.png,remember when illegal aliens just wanted to just go home now they want free food healthcare and housing,train,0,1,1,1
80765,../FHM/img/80765.png,bitches are like stitches pick on them and they open up,train,0,1,1,1
40257,../FHM/img/40257.png,lgbt virus gay zombie noises,train,1,1,,1
42315,../FHM/img/42315.png,half of trump supporters are deplorable half of your supporters are deportable,train,0,1,1,1
6375,../FHM/img/06375.png,we have peace but we can give wars,train,0,0,,0
15298,../FHM/img/15298.png,kim jong un had more during their debate american flags on display than the leftists did,train,0,0,,0
35017,../FHM/img/35017.png,three k s a day keeps you fat haha,train,0,1,1,1
48216,../FHM/img/48216.png,can you send a few dozen more officers please about his rights he s talking,train,0,1,1,1
3845,../FHM/img/03845.png,rev al sharpton that gorilla was black and unarmed,train,1,1,,1
89634,../FHM/img/89634.png,before you go around launching lawsuits let me remind you of the surveillance photos we have of you remember that a tranny crack whore doing lines off your dick,train,1,1,,1
60451,../FHM/img/60451.png,i love the smell of a dirty tranny relax adam let joe smell your schiff,train,1,1,,1
23158,../FHM/img/23158.png,therapy dogs are now being trained to console rape victims of muslims,train,1,1,,1
53206,../FHM/img/53206.png,when you re talented but also a self righteous shit head,train,0,1,1,1
68713,../FHM/img/68713.png,dad the dishwasher and the sandwichmaker are on the fritz again,train,0,0,,0
98574,../FHM/img/98574.png,blasts meme and parody pages shares posts from the babylon bee,train,0,0,,0
93208,../FHM/img/93208.png,jolo jew only live once,train,1,1,,1
72490,../FHM/img/72490.png,hello is it me you re looking for,train,0,0,,0
18257,../FHM/img/18257.png,men need walmarts sure they are dirty but when you re inside one at am you think i m glad these are here,train,1,0,0,0
7285,../FHM/img/07285.png,shame on you fork tongued devils,train,0,1,1,1
98425,../FHM/img/98425.png,when your moms plastic and you re a spastic tragedy,train,1,0,0,0
79385,../FHM/img/79385.png,well judge made me do it all remember it was me who first said was kenyan,train,0,0,,0
79845,../FHM/img/79845.png,number of pictures from when michelle obama was pregnant with sasha and malia zero,train,0,0,,0
51304,../FHM/img/51304.png,god loves all his children all of them,train,0,0,,0
5912,../FHM/img/05912.png,look at me i m the european now,train,0,0,,0
16874,../FHM/img/16874.png,that s a little racist,train,0,0,,0
79425,../FHM/img/79425.png,remember,train,0,0,,0
12784,../FHM/img/12784.png,when your chinese food shows up completely uncooked,train,0,0,,0
89314,../FHM/img/89314.png,come here you big cup of beautiful coffee and lie to me about how much we are going to get done today,train,0,0,,0
23940,../FHM/img/23940.png,monkeys often pick bugs off each other to snack on,train,0,0,,0
63715,../FHM/img/63715.png,this cat is getting raped tonight,train,0,1,1,1
96417,../FHM/img/96417.png,the cat slipped and fell into the toilet i was pushed,train,0,0,,0
23746,../FHM/img/23746.png,official muslim refugee checkpoint,train,1,0,1,1
32695,../FHM/img/32695.png,this is my ex looking for someone better than me,train,0,0,,0
95478,../FHM/img/95478.png,did you know women have small feet so they can stand closer to the sink,train,1,0,0,0
49153,../FHM/img/49153.png,when a porkistani nibba needs sex let me handle it,train,1,0,1,1
5719,../FHM/img/05719.png,islamomopolitan special feature know your place how to survive your women daily beating why men treat you like cattle,train,1,1,,1
49810,../FHM/img/49810.png,embrace the freedom of speech,train,0,0,,0
92375,../FHM/img/92375.png,somehwere in afghanistan a new book isbeing written shades of sheep,train,1,0,0,0
31495,../FHM/img/31495.png,walking into a smokers house like,train,0,0,,0
18294,../FHM/img/18294.png,when trump says i ll pay americans just for agreeignt to have a wall built,train,0,1,1,1
61257,../FHM/img/61257.png,my kid when i say stop you re gonna get hurt seconds later,train,0,0,,0
31640,../FHM/img/31640.png,and nothing of value was lost that day,train,1,0,0,0
8476,../FHM/img/08476.png,classic anne frank photo,train,0,0,,0
83907,../FHM/img/83907.png,barbed wire fence hall of cost victims let me eat let me eat,train,1,0,1,1
50372,../FHM/img/50372.png,he said he a lil bad ass so i hate this tendies in front of him,train,0,1,1,1
3418,../FHM/img/03418.png,i got a flat on my way to the store,train,0,0,,0
87023,../FHM/img/87023.png,please in the name of the lord let us all pray for jackson s safety most black gay men in america will get hiv says cdc,train,1,0,1,1
83125,../FHM/img/83125.png,when your girl is bulimic but you like gagging sounds so you call her fatty while you beat your meat in the shower,train,1,1,,1
1568,../FHM/img/01568.png,do you think a terrorist has or could infiltrate our goverment,train,1,0,1,1
23416,../FHM/img/23416.png,michelle obama sighted sun bathing in afghanistan,train,0,0,,0
47615,../FHM/img/47615.png,your pug is cute as hell that s my son,train,0,0,,0
96127,../FHM/img/96127.png,then i grabbed the booty like yahhhhhh,train,0,0,,0
17493,../FHM/img/17493.png,you know you re white trash hoes that talk too much shit stop acting like an innocent victim,train,1,1,,1
63578,../FHM/img/63578.png,i don t think he understands the gravity of his situation,train,0,0,,0
17458,../FHM/img/17458.png,i married my brother to commit immigration fraud this makes her an illegal alien ineligible for congress and deportable ice where are you,train,0,1,1,1
67348,../FHM/img/67348.png,kevin durant is without stephen curry stephen curry is without kevin durant no curry no chip,train,0,0,,0
23478,../FHM/img/23478.png,ever tried african food niether have they,train,0,0,,0
78302,../FHM/img/78302.png,when you found your wife is cheating on you ya allah,train,0,1,1,1
6725,../FHM/img/06725.png,open s inbox let me suck your dick opens profile it s your crazy ex gf,train,0,1,1,1
76032,../FHM/img/76032.png,back off f ing white male we are on a sex strike,train,0,1,1,1
54708,../FHM/img/54708.png,when the booze kicks in and you start putting out the vibes,train,0,0,,0
18546,../FHM/img/18546.png,when the weed hits you hard,train,0,0,,0
52867,../FHM/img/52867.png,happy national women s day just remember if it has an apple it has a banana,train,1,0,0,0
31295,../FHM/img/31295.png,i m a simple man i like beer and boobs,train,0,1,1,1
29675,../FHM/img/29675.png,remember behind every one of us is a police,train,1,0,1,1
69503,../FHM/img/69503.png,i heard we had a rat problem in the barn time to clean house,train,0,0,,0
84563,../FHM/img/84563.png,about to explode with pride now that his daughter can go to school,train,1,0,0,0
96845,../FHM/img/96845.png,barack obama is not america s first black president but america s first mixed race president,train,0,0,,0
73814,../FHM/img/73814.png,oh god oh fuck please end my suffering,train,0,1,1,1
95684,../FHM/img/95684.png,i m not transphobic i just don t like em,train,0,1,1,1
89267,../FHM/img/89267.png,dishwasher is broken then wash it by hand,train,0,0,,0
42503,../FHM/img/42503.png,inbreeding it s dangerous and wrong i stand here as living proof,train,1,1,,1
50413,../FHM/img/50413.png,i was going to paint my bathroom door but my girlfriend was dead against it,train,0,0,,0
42865,../FHM/img/42865.png,bend over touch your toes i ll show you where the monster goes,train,0,0,,0
54962,../FHM/img/54962.png,no i m on my period no i have diarrea,train,1,0,0,0
67843,../FHM/img/67843.png,would you look at that this dryer comes with a free dishwasher,train,1,0,0,0
40372,../FHM/img/40372.png,when the fbi raids your house and catches you nutting to petabytes of child porn wonderful weather we re having,train,1,1,,1
4719,../FHM/img/04719.png,how you see it how the turkey sees it,train,0,1,1,1
5421,../FHM/img/05421.png,there was a car pile up in mexico today people died,train,0,0,,0
64175,../FHM/img/64175.png,felt cute might go sit down to pee idk,train,0,0,,0
36910,../FHM/img/36910.png,at first i couldn t shoot then i thought shit that s how i d want to go,train,0,0,,0
26085,../FHM/img/26085.png,when i say i gotta go to the bathroom,train,0,0,,0
39158,../FHM/img/39158.png,people always working,train,0,0,,0
10692,../FHM/img/10692.png,this piggy just wants to say have a wonderful day,train,0,0,,0
42816,../FHM/img/42816.png,this look your wife gives you when you come home from a long day of suicide bombing,train,1,1,,1
71396,../FHM/img/71396.png,stand your ground law i said nibber get,train,1,0,1,1
49762,../FHM/img/49762.png,there are churches in america so why are there people sleeping on the streets,train,0,0,,0
2548,../FHM/img/02548.png,oi are you looking at me,train,0,0,,0
87125,../FHM/img/87125.png,what is that wonderful smell it smells like caramel oh today we burnt the diabetics,train,0,0,,0
42608,../FHM/img/42608.png,black parent white parent,train,0,0,,0
29851,../FHM/img/29851.png,how dark is your humor me,train,1,0,0,0
64153,../FHM/img/64153.png,ancestry com the results are in,train,1,0,0,0
6945,../FHM/img/06945.png,culebra u s territory u s miltary bomb explosions march,train,0,0,,0
84537,../FHM/img/84537.png,this steak is so black it stole my television,train,0,0,,0
74609,../FHM/img/74609.png,why do you hate us all we want to do ia move to your country condemn your lifestyle harass your women destroy your freedom of speech and march through your streets calling for people to be beheaded,train,1,1,,1
35168,../FHM/img/35168.png,waiting for your girl oustide her house,train,0,1,1,1
43085,../FHM/img/43085.png,last year tyrone got a new job started building his credit and spending more time with his kids then something amazing started to happen,train,0,0,,0
97184,../FHM/img/97184.png,i want it now is a good time,train,0,0,,0
58329,../FHM/img/58329.png,the bald eagle represents the strength and freedom of america,train,0,0,,0
57630,../FHM/img/57630.png,best holiday gift for muslims,train,1,0,0,0
76035,../FHM/img/76035.png,people are not mannequins don t be silent about domestic abuse,train,0,0,,0
94571,../FHM/img/94571.png,removes polish with chemicals nobody bats an eye removes polish with chemicals everybody loses his shit,train,1,0,1,1
83794,../FHM/img/83794.png,i m not talking to myself i m thinking out loooooooud,train,0,0,,0
79680,../FHM/img/79680.png,when you finally graduate in a school in the usa,train,1,0,0,0
21089,../FHM/img/21089.png,when you and your homie load each other s dishwashers,train,1,0,0,0
87261,../FHM/img/87261.png,how many nails are there in a lesbian s coffin none it s all tongue and groove,train,1,0,1,1
91872,../FHM/img/91872.png,the world calls it love god calls it abomination,train,0,1,1,1
81625,../FHM/img/81625.png,before i get drunk lose my phone get naked and arrested i want to wish you assholes a happy new year,train,0,1,1,1
50471,../FHM/img/50471.png,spanish word of the day texas my fren always texas me when i m not home wondering where i m at,train,1,0,0,0
27169,../FHM/img/27169.png,they are not escaping to find a better life they are invading us to destroy ours,train,1,1,,1
37084,../FHM/img/37084.png,stay in step you loser,train,0,1,1,1
48917,../FHM/img/48917.png,blackpeoplemeet com,train,1,0,0,0
75230,../FHM/img/75230.png,how to remember kid in hot car keep nd road beer with them,train,0,0,,0
91786,../FHM/img/91786.png,keeping your dishwasher clean will make it last longer,train,1,0,0,0
6847,../FHM/img/06847.png,matte black gloss black,train,0,0,,0
1293,../FHM/img/01293.png,when you forget to wash your hands,train,0,0,,0
81349,../FHM/img/81349.png,when you convert your dishwasher into a weed eater,train,0,0,,0
69708,../FHM/img/69708.png,goes on a date gets stood up,train,0,0,,0
96517,../FHM/img/96517.png,when muslims have been slaughtering millions of innocent people across hundreds of countries and finally someone gives them a taste of their own medicine,train,1,1,,1
56812,../FHM/img/56812.png,a rare picture of the beautiful jewish girl anne frank,train,0,0,,0
83607,../FHM/img/83607.png,your sense of humor is so dark people are worried about you,train,0,0,,0
18274,../FHM/img/18274.png,superman s flying class was popular but no one ever passed,train,1,0,0,0
85209,../FHM/img/85209.png,a short history of u s presidents,train,0,0,,0
40216,../FHM/img/40216.png,racing for pink slips in africa,train,0,0,,0
18296,../FHM/img/18296.png,your milkshake brings all the tards to the yard,train,0,1,1,1
32576,../FHM/img/32576.png,you never know how crazy they truly are until after you give them some good dick,train,0,1,1,1
8147,../FHM/img/08147.png,when you are back home from cheating,train,0,0,,0
60254,../FHM/img/60254.png,the best thing you can do is find a person who loves you for exactly what you are good mood bad mood ugly pretty handsome what have you the right person is still gonna think the sun shines out of your ass,train,0,0,,0
85034,../FHM/img/85034.png,virgo you re both white trash quite frankly,train,1,0,1,1
85741,../FHM/img/85741.png,smile for the photo,train,0,0,,0
30896,../FHM/img/30896.png,yo dawg i heard you like overthinking so you can overthink while you overthink so i made you overthink about overthinking,train,0,0,,0
59743,../FHM/img/59743.png,gas yourself,train,0,0,,0
69728,../FHM/img/69728.png,america nukes japan three days later ahhhh gettin kinda bored,train,1,0,0,0
72638,../FHM/img/72638.png,only a few understand what it s like to be and write your own will,train,0,0,,0
3124,../FHM/img/03124.png,muhammed fixing his calculator,train,0,0,,0
69520,../FHM/img/69520.png,those fucking russians,train,1,1,,1
6985,../FHM/img/06985.png,their average iq is about few points above being retarded,train,0,1,1,1
12086,../FHM/img/12086.png,i just wanna show you something comment what you think he s gonna show this goat fucker,train,1,1,,1
63712,../FHM/img/63712.png,and that was the last nativity play my son was invited to take part in,train,1,0,0,0
64385,../FHM/img/64385.png,there must be some way this victimizes me,train,0,0,,0
37294,../FHM/img/37294.png,life is like a box of chocolates it sucks if you have diabetes,train,0,0,,0
